I24U,I24U_Core
the boy is sleeping,1
the boy is yawning,0
the boy is going to sleep,1
the boy was sleeping,1
a boy is about to sleep,1
the boy is preparing to sleep,1
the boy is sleeping in his bed,1
the boy feels sleepy and he is going to sleep,1
the boy will full in sleep,1
peter was so sleepy he just finished his final project,0
a man is sleeping,1
the boy is asleep,1
a boy is sleeping on the bed,1
a boy is sleeping,1
the baby is sleeping in his own bed,1
the boy is laying down on the bed,0
the man is sleeping,1
the boy is sleeping on his bed,1
a boy is dead sleeping,1
the boy is sleepy and ready to sleep,1
the boy is tired and is going to sleep,1
the boy is sleeping sweet,1
a boy is sleeping in a bed,1
a boy is trying to get up,0
he is sleeping,1
a man is going to sleep,1
a boy is yawning,0
the boy is loosing sleep,0
the man is sleeping under the bad,1
the boy is sleeping profoundly,1
the boy is yawing on his bed and preparing go to sleep,1
the boy is feeling sleepy,0
a boy is sleeping with his mouth open,1
a boy is yawning on his bed,0
a kid is sleeping on his bed,1
one boy is sleeping in his bed and he is yawning right now,1
"the boy is sleeping, opening his mouth",1
this boy is ready to sleep,1
the boy is yawning in his bed,0
a boy is tired and goes to sleep,1
the boy is sleeping on his warm bed,1
a little boy is sleeping in bed,1
a child sleeps in a bed,1
a boy is sleeping on a bed,1
a boy is lying on a bed about to yawn,0
the boy is about to go to sleep,1
the boy is falling asleep,1
a young boy is sleeping in his tiny bed,1
a young boy is snoozing in his bed with his mouth wide open,1
he is yawning in bed,0
it is bedtime,0
the boy is about to go to bed,0
the boy is sleeping in the bed,1
the boy is snoring,0
the child is going to sleep,1
a little boy is sleeping in his bed,1
the young child is asleep in bed,1
the boy is lying in bed,0
a boy is asleep in bed,1
a boy is snoring,0
the boy is falling asleep in his bed,1
the young boy is tired and yawning,0
the boy is sleeping in bed,1
the child is fast asleep,1
a young boy is on a bed,0
a boy is sleeping on a bed under a red and yellow blanket,1
a little boy is sleeping,1
a little boy is in bed fast asleep,1
the boy is laying in bed,0
the tired boy lets out a yawn while laying in bed,0
boy is sleeping,1
the boy is in bed,0
the boy is having a sound sleep on the bed,1
wonder why the boy is sleeping with his mouth open,1
a boy is sleeping in a twin bed,1
a boy is under the covers sleeping in bed,1
the little boy is sleeping,1
the little boy yawning because hes ready to go to sleep,1
the boy is napping,1
a boy is sleeping in his bed,1
a boy is yawning in his bed,0
a boy is in bed,0
the boy is tired,0
"the boy, in his bed, is trying to get to sleep and is yawning",1
a sleep little boy is going to bed,0
a boy is going to sleep,1
the young man is being kept out of school with a serious illness,0
the diseaase the yiung man has could have been prevented with a shot but his parents prevented him from getting the shot,0
the boy is sleepy,0
the boy is sick,0
an open mouthed boy is sleeping,1
the little boy yawns as he's about to fall asleep,1
the little boy is yelling for his parents because he's scared of the dark,0
a boy yawns as he goes to sleep in his bed,1
the boy is covered up in his bed and he yawns because he is tired,0
eating cheetos in bed,0
bed covered in cheetle,0
the boy is yawning as he falls asleep,1
the boy is sleeping soundly with his mouth hanging open,1
the little boy is fast asleep,1
the little boy is about to wake up,0
a person is in bed,0
a person is asleep,1
a young boy is peacefully sleeping in his bed,1
just the right size bed for this young boy,0
sleep overtakes the boy,1
the boy is about to fall asleep,1
the boy is yawning and about to fall asleep,1
the boy is sleeping with his mouth open,1
he is ready for bed,0
a child is asleep in bed,1
a child is lying in bed,0
john is sleeping,1
bedtime and sleep are important,0
mouth breathing sleeper copes with nasal congestion,1
yawning and other muscle contractions as you drift to sleep,0
joe is fast asleep,1
"joe, you must get up for school",0
"a little boy is in bed, sleeping",1
"after a rough day playing pee wee football, tommy is struggling to stay awake, but finds himself constantly yawning",0
a boy goes to sleep,1
a boy is waking up,0
j,0
h,0
the bow is sleeping in his bed,1
a person sleeping on a bed,1
picture of bed and someone sleeping in it,1
cold,0
child sleeping,1
hahahah,0
hahaha,0
young boy snoring so loudly that his blanket is rising from the bed,0
toothache is so painful that young boy cannot close his mouth,0
the boy is laying in his bed,0
the boy is yawning as he prepares to fall asleep,1
the boy is dreaming about performing fellatio on the hulk,0
