Source,Response,A1,A2
I01U_Interp,The boy is being attacked by music notes.,0,1
I01U_Interp,Music makes the kid happy.,1,0
I01U_Interp,The boy is having fun listening to music.,1,0
I02U_Interp,He is hungry for pizza.,1,0
I03U_Interp,"The finance is gifting a box to his wife-to-be on their anniversary, for it is a token of his passion. ",0,1
I03U_Interp,The delivery service drops off a package to its destination.,0,1
I03U_Interp,The delivery man is falling love with the girl while delivering.,0,1
