I28T,I28T Answer
the man is showing a girl where to go,
the man is telling the girl where to go,
the man is telling the directions for the girl,
the man is showing the direction to the woman,
the man is telling the woman what direction she should follow,
the man is giving direction to the tourist,
he is telling the women which way she should go,
the man is guiding for a girl,
he talks about the direction with this girl,
the man is directing,
the man is helping the girl who is lost,
the man help the girl to find the correct direction she doesn't know,
the man is pointing a direction for a female tourist,
the man's looking at the map and guiding the way,
he is tell the girl how to use the map,
the man is guiding the woman about the direction,
the man is pointing the direction for a woman,
a man is telling the direction for a woman,
the man is directing the way to help the girl,
the man is showing the direction to the female,
a girl is asking for help to the man,
the man is directing the way for the girl,
he is showing a girl the way,
the man is giving directions to the woman,
the man is showing the direction to the girl,
he is telling a direction to a traveler,
the man who in yellow is showing the way to a girl,
the man is pointing the way to a traveler,
the man is showing a location to this girl,
he is helping the lady out,
the man is looking at the map to find the direction,
the man is guiding,
a man is guiding a visitor who holds a map,
the man is pointing to a direction,
a man tries to tell the place that lady wants to get,
the man is telling to that girl how to get to that place in the map,
the man is giving direction to the woman,
the man is pointing the direction,
the man is guiding with the map,
the man is pointing the way for the woman,
the man is showing the woman directions using map,
he is telling the direction that the woman need to follow,
he is pointing somewhere,
he is indicating the way,
the man is telling the girl the way to her destination,
he is helping the girl to find the way to go,
the man is pointing the routine for a woman,
the man is telling a girl where to go,
the man is looking at a map carefully and directing a way to the woman,
the man is leading the girl a right way to the destination,
the man is explaining the route to the girl,
the man is showing the girl how to get to the place she wants to go,
the man is telling the girl the how to achieve her destination,
the man is guiding a girl to somewhere on map,
the people are watching the map,
a man is showing the direction for a visitor,
the man is leading the girl,
the man is helping a visiter to find her way,
the man is showing the way to the girl,
directing the road for the tourist,
he is helping the girl to find the way,
the man is pointing at a direction,
the man is directing the route for the woman,
the man is giving directions to the lady,
the man is helping the woman find the place she is heading,
the man is showing the way to the woman by pointing the map,
the man is telling her how to get to the destination,
the man is giving directions,
the man is showing the woman directions on a map,
the man is giving the woman directions,
he is telling her where to go,
the man is pointing in the right direction for the hiker,
the man is looking at a map,
the man is giving the backpacker directions,
the man is showing the backpacker how to find a location on the map,
he is giving directions,
the man is telling her where to go,
the man is telling her what to do,
he is giving directions to the backpacker,
he is giving directions to the girl,
he is explaining how to get to a certain place,
the man is giving directions to the girl,
the man is showing the woman which way to go,
the man is helping the woman with directions,
the man is hiking,
the man is pointing in the direction that she should go,
the man is giving the girl directions to where she wants to go,
the man is showing the girl where to go by using her map,
the man is pointing the girl in the right direction,
telling the lady where to go,
telling the lady where not to go,
the man is pointing,
giving directions,
hiking,
the man is hiking with the woman,
the man is giving the hiker directions,
the man is directing the girl which way to go,
hugging,
looking at a map,
helping give her directions,
he is giving her directions,
helping the woman find her way,
the man is showing directions,
he is pointing out the way,
the man is providing directions to the hiker,
the man is showing the hiker points of interest on the map,
man is giving verbal directions,
man is helping girl find her way by assisting her with reading the map,
the man is pointing out the directions to the hiker,
the man is giving the girl directions,
he's giving her directions,
reading,
holding a friend,
the woman with the map is getting directions from a man,
the man is telling the woman with the map which way to go,
the man is offering directions,
"sally is too stupid to read a map, so steve just points",
the man is giving instruction to the girl,
the man is giving a direction to the lady,
the man is teaching the girl how to read a map,
the man is helping the tourist,
the girl asks for directions,
the map is hard to read,
being mad at her,
sending her to her room,
direction her to right direction,
pointing,
the man is pointing in the direction the girl should go,
the man is trying to explain which way the girl should go,
he is telling the woman where she can go with her bullshit,
the boy is giving the girl directions,
the man is giving direction,
giving the woman directions,
he is giving the woman directions to the porn shop,
asdf,
getting her number,
showing the lady directions,
the man is giving directions to the hiker,
while pointing toward a landmark the man is trying to figure out if it's a long haired guy or a really flat chested girl hiker he's giving directions to,
the man is giving ditections,
the man is helping the woman who is lost,
the man is navigating a map,
kara asked a fellow camper for directions to the women's bathrooms,
"with a tablet, smartphone, and internet service, a person can find directions to many different places",
the man is giving directions to a woman,
the woman is listening to the man who is giving directions,
fixing to be in trouble for not asking for directions before they got to the park. she is frustrated by his lack of planning and she is going to leave him when they get back home for a more responsible person,
he is trying to find the current location on the map,
the man is standing,
the man it pointing out the location from the map,
the man is showing which direction to go,
the girl is listening to the directions given,
he is vacationing somewhere unfamiliar to him,
he is being confused by a map,
don't know,
the man is telling the woman where to go,
he is explaining the route on the map,
the man is giving the woman instructions,
the man is point in the direction the woman needs to go,
the man is giving directions to a tourist,
he is showing the tourist direction,
he is pointing to a location,
the man is referring to the map which the woman is holding,
the man is pointing out a geographic feature which is on a map,
arguing with the woman about what trail to take,
getting directions,
the man is giving directions to a hiker,
the man is reading a map,
the man is showing her the way,
the man looks like he's giving someone directions,
he's giving someone directions,
reading a map,
giving directions to woman,
showing woman how to read a mqp,
he's telling her where to go,
showing his girlfriend how to read a map,
showing her where the bodies are,
in the direction,
the man is pointing out directions,
the man is offering directional assistance,
the man helps the hiker with directions on a map,
the man shows a girl where to go on a map,
the girl has asked the man for directions,
