I18,I18 Nativ
the man is coughing,
a man is coughing,
he is have a ill,
the man is sneezing,
the man sick,
the superman is coughing,
a man is making noise,
the man is sick,
the man is illness and he is cough,
the man is coughing loudly,
a man is uncomfortable,
the illness man is coughing,
the man is illness,
the man is singing,
this man gets tired,
th man is doing b-box,
the man is having a cough,
he is coughing,
a man is being sick,
the man is thinking,
the man is trying to make everyone quiet,
he is getting cold,
the man is feeling uncomfortable,
the man is going to kiss his fist,
a man is shouting,
a man got a cold,
this man is coughing,
the man is yawning,
the man is pretending he is singing with one microphone,
the man is feeling not pretty well,
this man wants to kiss his hand,
the man is pretending he is singing now,
the man is clear his throat,
he closed his eyes to cough,
the man is yelling,
the man want to fight someone or something,
the man's coughing,
a man is prepare to sing,
a man is socaring,
the man is,
the man is holding his fist,
the man is shutting,
he is yawning,
the man gets sick,
the man is putting his punch front of his mouth,
man is cough,
the man is going to make an announcement,
a superman is ...?,
the man seems to be coughing,
a man has a bad cold,
the man is couching,
the man is going to sneeze,
the man in red is coughing,
i don't know how to describe that,
he is singing by himself,
he is speaking,
the man has a cough,
tha man is snoring with eye-closed,
he is cheering,
a superman is coughing,
the man is blowing his fist,
the man is sleepy,
the man feels not good,
coughing,
the man is about to sneeze,
the man is cuffing,
the man is thinking something annoying,
a man is coughing into his hand,
the man is covering his mouth when coughing,
a man cover's his mouth in order to cough,
the man is sick and covering his cough,
a man (it may be superman) is coughing into his clenched fist,
superman is coughing or sneezing into his clenched fist,
a man is covering his mouth,
he is clearing his throat,
"the man is in the middle of playing rock, paper, scissors",
the man isn't feeling well today,
a sick man is coughing,
the man is covering his mouth while he coughs,
the man is punching himself in the mouth,
the man is punching himself in the nose,
his hand is receiving a sneeze,
a man is clearing his throat,
the man is coughing into his hand,
the polite man raises his fist to cover his cough,
the man is holding his fist close to his mouth,
the man has a cold,
good,
feel good,
a man in a red shirt is coughing,
a man is coughing in his fist,
the man doesn't feel well,
a man is covering his cough with his fist,
a man coughs,
a guy politely covers his mouth while he is coughing,
man is coughing,
the man is mad,
man is waking up from sleep,
a man is coughing into his fist,
the man is covering his mouth due to coughing,
a man is going to cough,
a man is clinching his fist,
the image is not loading,
the image did not load on the computer,
a man is sneezing,
the man is covering his mouth as he coughs,
the man has a terrible cough,
the man is using his hand to try to stop his cough from going anywhere,
a man is hiding a cough with his hand,
he was coughing,
he coughed in his hand,
the man is covering his cough with his hand,
the young muscle man is trying to imagin iron in his fists,
iron in his fists makes his a winner in the ring,
the man is covering his cough,
there is a coughing man,
"the man in the red shirt is covering his mouth, while he coughs politely",
the man is coughing into his balled fist,
elvis blows on the craps dice,
fist surprise punches elivis in the mouth! wham,
a man is punching himself in the face,
the man is covering his cough with his fist- but not very well,
the man is pretending to use a microphone,
a man his hitting himself in the face,
the man in the red t-shirt is sneezing,
look how he covers his sneeze with his hand,
the man is covering his mouth when he coughs,
a cough is being covered by the man,
a man is singing with an air microphone,
the cough got to the man,
the man is loudly clearing his throat,
the man is coughing due to a cold,
a person is coughing,
the man looks ill,
he have a cough,
a man is fighting a sneeze,
the man is using his hands to close his mouth,
man coughs,
"in the moment before he magically transforms into a superhero, the protagonist's anger begins to explode",
joe has a cold,
joe is covering his cough,
a man has a cough,
the man is trying to cover his cough,
"paul, the man in the red shirt, has been struggling with having a cold all week and still has a nasty cough",
an adult is coughing into his hand,
an adult is coughing and covering his mouth. how many more examples do you need to see one ends their sentences with a noun? enough already,
a man in a red shirt coughs,
h,
this man is covering his mouth while he coughs,
a man is covering his mouth while coughing,
this man is sneezing into his hand,
man is trying to sneeze into his fist,
covering mouth,
what the,
fuck,
the stud in the red shirt is singing karaoke,
the blind one armed man in the red shirt is sneezing,
that man is coughing very loud,
david is sick today,
being safe,
sick guy,
the man is hitting himself in the face,
the man had a coughing fit,
the man covered his cough,
the man in the red shirt is coughing,
the man is covering up a cough,
he might be covering up a sneeze,
the man is tired out,
the man coughs,
a guy clears his throat,
the man sneezes,
he is attempting to cover a cough or sneeze,
he is trying to prevent germs from spreading,
he is coughing into his hand,
punching himself,
the man maybe sneezing,
he has a haking cold,
has a headack that hurts,
this man may be contagious,
sneezing,
the man is using his hand to cover his cough,
the man is covering his mouth to cough,
the man is sneezing into his hand,
man is coughing into his hand,
the boy in the red shirt coughed,
the young man coughs into his fist,
he coughs,
he has a bad cough,
he might be singing or humming,
eyes closed,
the man coughed,
the man is couging,
wannabe elvis punching himself in shame,
cevering the mouth while coughing,
clearing his throat,
hacking,
he is feeling sick,
"aw chew, goes the sneeze",
coughing really gets to me,
"covering his mouth while coughing,",
getting ready to cough,
sick,
the man has a sickness,
the man could be coughing,
the man could be acting like he is singing,
the man is catching a cold,
the man is getting ready to roll dice,
he is coughing up a hairball cause his wife won't shave her snapper,
"""are you choking"" i asked",
he is coughing because he is sick,
he is trying to stifle a cough,
the man is covering his mouth while he's coughing,
the man is sneezing because he has allergies,
"when sneezing, one should always cover their mouth",
the man is covering his mouth to sneeze,
the man is sniffling a sneeze,
the .man is hitting himself,
this man is sick,
the man is pretending to sing into a microphone,
he is serenading his girlfriend on his pretend microphone,
the man is covering a cough,
he is hitting his nose with a fist,
he is smelling his fingers,
guy got cough,
the man is sneezing into his fist,
the man is coughing into his fist,
he's covering his mouth while he coughs,
the is man is trying to clear his throat,
the man is coughing because he is sick,
he is posing,
the man is coughing into his closed fist,
covering his cough,
catching a cold,
he is sneezing,
the man has is sneezing,
he's covering his mouth cause he's coughing,
coughing into his hand,
the man is holding his fist to his mouth as he coughs,
the guy is stifling a cough,
"guys she was great, she had this new technique where she grabbed it like this",
"afterwards, i was his favorite alter boy",
outlod,
the man is squeezing his fist in concern,
the man is covering his mouth to cough with his fist,
the man is coughing into his right hand,
the man is finishing coughing,
