I25T,I25T Interp
the dog is chasing a cat,
the dog is chasing an animal,
the dog is chasing cat,
the dog is chasing the cat,
the dog is catching a cat,
the dog is running for getting a cat,
the dog want to catch the fox,
the dog is trying to catch the cat,
a dog try to catch a cat,
a dog is catching another one,
the dog is catching the cat,
a dog is chasing a cat,
the dog is chasing,
the dog is chasing to the cat,
a dog is catching a yellow cat,
the dog is running away behind a hat,
a dog is catching a cat,
the dog is catching an orange cat,
the dog is chasing with a cat,
a dog trying to catch a orange cat,
the dog is catching that cat,
the dog is catching the other dog,
the dog on the back is chasing the yellow dog,
the dog is running after the cat,
it is trying to get the cat,
the dog is running to catch the cat,
it is trying to catch the cat,
the dog is catching up the cat,
the black and white dog is chasing a yellow cat,
the dog is trying to catch the frightened cat,
the dog is chasing another dog,
the dog is trying to catch a cat,
the dog hunting the cat,
a dog is chasing after a cat,
the dog is running,
the dog is trying to catch the other dog,
chasing the cat,
he is chasing the cat,
the dog is tracing the squirrel,
he is running behind to catch the other dog,
the dog is running to catch the box,
the dog chases the cat,
the dog lunges after the cat,
the dog is jumping after a cat,
it is running after the feline,
he is running after it,
the dog is leaping for the cat,
he is trying to catch the cat,
the dog is scaring the cat,
the dog is after the cat,
the dog is playing with the cat,
the dog is running away from whatever is chasing it,
the cat is running away from the dog,
attacking the cat,
fighting with the cat,
running,
chasing cat,
the dog is frightening the cat,
chasing a cat,
chasing the squirel,
jumping,
the dog is attacking the cat,
the dog is pursuing the cat,
chasing after the cat,
the dog is running after a cat,
the dog is bounding after the cat,
dog is chasing cat,
dog and cat are running away as if scared,
the dog jumped after the cat,
he is running after the cat,
running after the cat,
braking,
the cat is running from the dog,
cat and dog slide down ice covered hill into oncoming traffic,
chasing the other dog,
trying to catch the other dog,
the dog jumped at the cat,
the dog is playing with his friend,
the cat screams meow as she is almost caught by the dog,
the cat is scared,
trying to catch a cat,
jumping in the air after a cat,
catching cat,
the cat is afraid of the dog,
he is chasing a cat,
he is chasing his arch enemy,
cats are the best,
yeah,
the dog is just as surprised as the cat is that they can fly,
the dog is going after the cat,
dogs love to chase cats,
the dog chases the cat to get his daily exercise,
playing with the cat,
he is jumping after the cat,
the dog is falling,
the dog is running behind a cat,
he is running,
he is flying,
catch cat,
the dog is jumping after the cat,
he is leaping after the cat,
the dog is running behind the cat,
the dog is chasing and scaring the cat,
the dog is scared,
the dog is flying through the air in pursuit of a flying cat,
the dog is pursuing a cat,
the dog is chasing a squirl,
the dog is looking for a play mate,
running away from something,
the dog follows the cat as they both flee something scary,
leaping for the cat,
trying to bite acat,
he's chasing the cat,
the dog is chasing pussy,
the dog is ice climbing,
fighting,
a dog,
the spotted dog is chasing after a brown cat,
the dog tries to catch a cat,
the cat is being chased by the dog,
flying,
chasing,
