I30,I30 Gramm
the woman is running,
she is running,
the woman is jogging,
the girl is running,
a woman is running,
the young lady is running,
the women is running to a open area because the earthquake is happening,
a girl is running,
the women is running,
a woman is jogging,
the woman is running to protect her health,
a lady is jogging,
this teenager is running for fitness,
the lady is running,
a lady is running,
a teenager is jogging,
she is jogging,
the lady is exercising,
the girl is running to make a exercise,
a young girl is running,
the woman is running hardly,
this lady is running,
the woman is running on the road since she wants to lose her weight,
the woman is joking,
she's jogging,
the woman is doing exercise,
a girl is running with pink shoes,
the woman who in pink is running,
the woman is running right now,
woman is running,
the woman is training,
a women with a pink shirt is running,
the woman is running or jogging,
the woman is judging,
the woman is exercising,
the woman is running in an average speed with her sport-fit cloths,
the woman is jogging and breathing heavily,
running,
a lady goes for a run,
a lady is enjoying a jog,
the woman is sprinting to the finish,
a woman is jogging in a race,
a girl is jogging,
"jogging is happening, yo",
the girl is exercising,
the woman is trying to keep fit,
the girl is jogging,
the girl is working out,
a woman is out for a run,
a person is jogging along,
the woman is getting in shape for beach season,
the lady is jogging,
the girl is running for exercise,
the female is running,
the female is jogging,
the girl is running a marathon,
a woman with brown hair is running,
a woman is running with red and blue shoes,
she is exercising,
she likes to run,
a woman is running for exercise,
a woman goes for a jog,
the woman is excercising,
the girl is jogging for exercising,
the girl has put on a jogging shoes for running a race,
the lady is doing excercise,
a woman is exercising,
the woman went for a run,
the runner is a girl,
"to keep fit, the lady runs daily",
a woman is taking a jog,
the runner is training for the upcomming soccer season. running or jogging are excellent ways to develope endurance strength,
along with the development of strength a major benefit of jogging or running is cardio development which adds to awinning soccer season,
the girl likes to jog,
there is a running girl,
the woman is running to get in some exercise,
the woman is running while thinking about her day,
a woman with a ponytail runs,
anne runs left,
the earth gets kicked by anne,
the woman is jogging for exercise,
the girl is out for her running exercise of the day,
the girl is doing her running exercise on a nice summer day,
a person is wearing red shoes,
a person is running,
this is the way she runs in every day activity,
a young woman is running as a way to stay fit,
running is this woman's chosen activity,
the girl is going on a run,
she likes to jog,
jogging is healthy for the body,
a person is exercising,
a person is jogging,
??,
jogging takes stamina,
exercise helps mental and physical needs be fulfilled,
"after losing 30 pounds, marcie has decided to pick up the pace and begin running even more",
f,
d,
the woman i running,
jogging is one of her hobbies,
girl is running for exercise,
a girl is running with long hair,
girl jogging,
staying in shape,
hey man,
can you please tell me where the bathroom is?,
you can't let a good one get away,
the woman is going for a run,
the woman is taking a run,
alice really hopes she can stay ahead of the bear until she reaches the suburbs,
the woman is going for a jog,
jogging is her favorite exercise,
the woman is working out,
the woman runs,
the woman in the red shoes is exercising by jogging,
the woman is getting some exercise,
exercising,
running a marathon,
jogging to work,
fittness,
the woman is trying to be healthy,
jogging,
she is going on a run,
she is jogging down the street,
the woman is getting in a run,
woman is jogging,
woman is exercising,
the women is jogging,
the women in the keds is trying to run,
"janet set a new years resolution to get in shape. by jan 9th, she was back on the sofa with a box of bon-bons",
the woman is trying to get fit,
this is a long trail to jog,
these new shoes are comfortably on this trail,
she's running for health,
she's late for a date,
she is wearing a red shirt,
she is training for a triathlon cause she is trying to prove herself to the world and her feminist group,
aa,
asd,
"she's wondering if anyone thinks her pony tail is sexy. (by the way, it is)",
the woman is walking,
kasey jogs ever day for exercise,
exercising makes the day so much better,
the woman is running a race,
she is trying to be someone that the magazine tells her she should be. she would rather stay at home and eat a whole lot of cupcakes,
the woman is farting,
she is wearing pink shoes,
she is a runner and she is running,
the woman is out for a run,
the woman is trotting,
running to catch a bus,
chasing someone,
going for a run,
running to the store to buy more yoga pants,
trying to run away from her bad decisions,
for sport,
the woman is running for exercise,
the woman is exercising by running,
