ResponseID,Response,Core,Answer,Gramm,Interp,Verif
I15U-gNSC-p322-r1,Spring has sprung and he is planting a tree.,1,1,1,1,0
I15U-gNSC-p322-r2,Spring fever has hit so he is planning for the future by planting a shade tree.,1,1,1,1,0
I15U-gNSC-p325-r1,A man is planting a tree,1,1,1,1,1
I15U-gNSC-p325-r2,A tree is being planted by a man,1,1,1,1,1
I15U-gNSC-p334-r1,"Just prior to his divorce, a man celebrates with the removal of the tree that him and his wife planed the day they were married. ",1,0,0,0,0
I15U-gNSC-p334-r2,A man does yard work in slippers. ,0,0,1,0,1
I15U-gNSC-p343-r1,The man is planning a tree in his yard,1,1,0,0,1
I15U-gNSC-p343-r2,The man is happy planning a young tree in his yard,1,1,0,0,1
I15U-gNSC-p344-r1,man is planting a tree,1,1,0,1,1
I15U-gNSC-p344-r2,man is replanting a tree,1,1,0,1,1
I15U-gNSC-p352-r1,A man is planting a tree. ,1,1,1,1,1
I15U-gNSC-p352-r2,A tree is being palnted. ,0,1,1,0,1
I15U-gNSC-p355-r1,A man is planting a tree.,1,1,1,1,1
I15U-gNSC-p355-r2,A man is doing some landscaping.,0,1,1,0,1
I15U-gNSC-p356-r1,A man is planting a tree. ,1,1,1,1,1
I15U-gNSC-p356-r2,A tree is being planted by a man. ,1,1,1,1,1
I15U-gNSC-p358-r1,A guy plants a tree,1,0,1,1,1
I15U-gNSC-p358-r2,A man planting a tree in his yard ,1,1,0,1,1
I15U-gNSC-p359-r1,A man is planting a tree.,1,1,1,1,1
I15U-gNSC-p359-r2,A man is outside gardening.,0,1,1,0,1
I15U-gNSC-p363-r1,The man is planting a new tree.,1,1,1,1,1
I15U-gNSC-p363-r2,The man is replacing the tree. ,1,1,1,0,1
I15U-gNSC-p364-r1,The man is planting a sapling.,1,1,1,1,1
I15U-gNSC-p364-r2,The man has just dug up a sapling.,1,0,1,1,1
I15U-gNSC-p365-r1,This guy is going green by planting new plants.,1,1,1,1,1
I15U-gNSC-p365-r2,This guy is excited to plant his first plant.,1,0,1,1,0
I15U-gNSC-p367-r1,Man planting a tree.,1,1,1,1,1
I15U-gNSC-p367-r2,Man removing a tree.,1,1,1,1,1
I15U-gNSC-p370-r1,A man is planting a tree,1,1,1,1,1
I15U-gNSC-p370-r2,A man has dug a hole and planted a tree,1,0,1,1,1
I15U-gNSC-p374-r1,The man is planting a tree.,1,1,1,1,1
I15U-gNSC-p374-r2,The man has dug the tree out of the ground and is now trying to strangle the tree to death because this man is insane.,1,1,1,1,0
I15U-gNSC-p377-r1,gardening,0,0,1,0,0
I15U-gNSC-p377-r2,gardening with shovel,0,0,0,0,0
I15U-gNSC-p379-r1,A hole has been dug so a sapling can be planted.,0,0,1,0,1
I15U-gNSC-p379-r2,The sapling is ready to be planted.,0,1,1,0,1
I15U-gNSC-p380-r1,Plant dig by a man,0,0,0,0,0
I15U-gNSC-p380-r2,A man digged and planted a tree.,1,0,0,1,1
I15U-gNSC-p383-r1,The man is planting a tree.,1,1,1,1,1
I15U-gNSC-p383-r2,The man digs a hole for his new tree.,1,0,1,1,1
I15U-gNSC-p385-r1,TIME TO PLANT THE TREE.,0,0,1,0,0
I15U-gNSC-p385-r2,ITS A NICE DAY TO PLANT A TREE.,0,0,0,0,1
I15U-gNSC-p387-r1,He is planting a tree.,1,1,1,1,1
I15U-gNSC-p387-r2,The tree that is being planted is to replace another tree.,0,1,1,0,0
I15U-gNSC-p390-r1,Where can I transplant this cannabis plant?,0,0,1,0,0
I15U-gNSC-p390-r2,"Hey, wait a minute, this ain't cannabis!",0,0,1,0,0
I15U-gNSC-p393-r1,The gardener is about to plant a tree.,1,1,1,1,1
I15U-gNSC-p393-r2,The gardener has just removed a tree from the ground.,1,0,1,1,1
I15U-gNSC-p394-r1,The man is planting a tree,1,1,1,1,1
I15U-gNSC-p394-r2,The man planting an apple tree for his mother.,1,1,0,1,0
I15U-gNSC-p396-r1,A man is planting a tree,1,1,1,1,1
I15U-gNSC-p396-r2,The tree is being planted by the man,1,1,1,1,1
I15U-gNSC-p401-r1,The man is planting a small tree.,1,1,1,1,1
I15U-gNSC-p401-r2,"In order to plant his small tree, the man first dug a hole with a shovel.",1,0,1,1,1
I15U-gNSC-p405-r1,A tree is planted. ,0,0,1,0,1
I15U-gNSC-p405-r2,A man is planting a tree.,1,1,1,1,1
I15U-gNSC-p407-r1,The man has dug a hole,0,0,1,1,1
I15U-gNSC-p407-r2,The man is planting a tree,1,1,1,1,1
I15U-gNSC-p409-r1,A man is planting a tree.,1,1,1,1,1
I15U-gNSC-p409-r2,A tree is being planted.,0,1,1,0,1
I15U-gNSC-p410-r1,The man is planting a new tree.,1,1,1,1,1
I15U-gNSC-p410-r2,This tree is being planted for landscaping.,0,1,1,0,1
I15U-gNSC-p411-r1,"In the Summertime, a man is planting a tree in the hole in the ground.",1,1,1,1,1
I15U-gNSC-p411-r2,A man has dug a hole in the ground and is going to plant a tree.,1,1,1,1,1
I15U-gNSC-p413-r1,He is gardening.,0,1,1,0,1
I15U-gNSC-p413-r2,The man plants a tree.,1,0,1,1,1
I15U-gNSC-p416-r1,Man planting a tree,1,1,1,1,1
I15U-gNSC-p416-r2,A tree bent planted by a men,0,0,0,0,0
I15U-gNSC-p418-r1,A man is planting a tree.,1,1,1,1,1
I15U-gNSC-p418-r2,A tree is being planted by a man.,1,1,1,1,1
I15U-gNSC-p420-r1,A man in a blue tank top is planting a young tree.,1,1,1,1,1
I15U-gNSC-p420-r2,A man wearing a red cap and bedroom slippers is planting a nearly denuded shrub in a hole that is much too small.,1,1,1,1,0
I15U-gNSC-p423-r1,A man is planting a tree. ,1,1,1,1,1
I15U-gNSC-p423-r2,A hole was dug for a new tree to be planted. ,0,0,1,0,1
I15U-gNSC-p424-r1,Gardener is planting a sapling ,1,1,0,1,1
I15U-gNSC-p424-r2,He is excited to replant the tree ,1,0,1,1,1
I15U-gNSC-p429-r1,A man lovingly plants a sapling,1,0,1,1,1
I15U-gNSC-p429-r2,A sapling finds a new home,0,0,1,0,1
I15U-gNSC-p431-r1,Planting a tree,0,0,1,0,0
I15U-gNSC-p431-r2,A guy planting a tree,1,1,1,1,1
I15U-gNSC-p433-r1,The man is planting a tree.,1,1,1,1,1
I15U-gNSC-p433-r2,The man is putting the tree in the hole.,1,1,1,1,1
I15U-gNSC-p435-r1,man,0,0,0,0,0
I15U-gNSC-p435-r2,planting a tree,0,0,1,0,0
I15U-gNSC-p436-r1,A man is planting a tree.,1,1,1,1,1
I15U-gNSC-p436-r2,A man is working for a conservation group planting trees.,1,1,1,1,0
I15U-gNSC-p438-r1,The man is planting a tree.,1,1,1,1,1
I15U-gNSC-p438-r2,The man dug a hole to plant a tree.,1,0,1,1,1
I15U-gNSC-p447-r1,A man is planiting a tree.,1,1,0,1,1
I15U-gNSC-p447-r2,A shrub is being replanted by a man.,1,1,1,1,1
I15U-gNSC-p448-r1,The man plants a tree.,1,0,1,1,1
I15U-gNSC-p448-r2,The man in the red hat is excited to plant a tree.,1,0,1,1,1
I15U-gNSC-p450-r1,found my tree,0,0,1,0,0
I15U-gNSC-p450-r2,loving it!,0,0,1,0,0
I15U-gNSC-p451-r1,The man is planting a tree.,1,1,1,1,1
I15U-gNSC-p451-r2,The tree is dying.,0,1,1,1,0
I15U-gNSC-p452-r1,It is time to plant a tree.,0,0,1,0,1
I15U-gNSC-p452-r2,The boy is planting a tree to help the environment. ,1,1,1,1,0
I15U-gNSC-p453-r1,He is planting a new tree.,1,1,1,1,1
I15U-gNSC-p453-r2,He dug a hole to put his new tree in.,1,0,1,1,1
I15U-gNSC-p455-r1,A man is planting a tree.,1,1,1,1,1
I15U-gNSC-p455-r2,A gardener plants a small tree.,1,0,1,1,1
I15U-gNSC-p456-r1,The young man is planting a sapling.,1,1,1,1,1
I15U-gNSC-p456-r2,The young tree will soon occupy the newly-dug hole in the ground.,0,0,1,1,1
I15U-gNSC-p457-r1,The man is planting a tree. ,1,1,1,1,1
I15U-gNSC-p457-r2,The man has dug a whole and is planting a sappling. ,1,1,0,1,1
I15U-gNSC-p460-r1,The man plants a tree.,1,0,1,1,1
I15U-gNSC-p460-r2,The tree is planted by the man.,1,0,1,1,1
I15U-gNSC-p461-r1,The man dug a hole to plant a tree.,1,0,1,1,1
I15U-gNSC-p461-r2,The man is planting a tree in the hole he dug. ,1,1,1,1,1
I15U-gNSC-p462-r1,A man is planting a tree.,1,1,1,1,1
I15U-gNSC-p462-r2,A tree is being planted by a man.,1,1,1,1,1
I15U-gNSC-p467-r1,A man is planting a tree.,1,1,1,1,1
I15U-gNSC-p467-r2,"Eager to improve the landscaping for his house, the homeowner installs a new plant.",1,0,1,1,0
I15U-gNSC-p469-r1,The man plants a sapling.,1,0,1,1,1
I15U-gNSC-p469-r2,A man risks federal prosecution by removing a tree from a National Forest.,1,1,1,1,0
I15U-gNSC-p479-r1,A man is planting a tree.,1,1,1,1,1
I15U-gNSC-p479-r2,A tree is being planted.,0,1,1,0,1
I15U-gNSC-p482-r1,The man is planting a tree. ,1,1,1,1,1
I15U-gNSC-p482-r2,The man is happy. ,0,0,1,1,1
I15U-gNSC-p483-r1,The man plants a tree.,1,0,1,1,1
I15U-gNSC-p483-r2,"It's summer, and time for yard work again.",0,0,1,0,1
I15U-gNSC-p485-r1,He planted a tree.,1,0,1,1,1
I15U-gNSC-p485-r2,The tree was planted by him.,1,0,1,1,1
I15U-gNSC-p491-r1,The man is planting a tree.,1,1,1,1,1
I15U-gNSC-p491-r2,"The man is doing a ""green"" thing.",0,1,1,0,1
I15U-gNSC-p493-r1,A man plants a tree,1,0,1,1,1
I15U-gNSC-p493-r2,A tree is removed from the ground,0,0,1,0,1
