I04U,I04U_Answer
a boy is waking up in the morning,1
the boy is getting up in bed,1
a boy just woke up,0
"on the wonderful morning, the little boy is getting up because of the clock",1
a kid woke up from sleeping,0
the boy is stretching in the morning,1
the clock rings and makes the boy wakes up,0
a man is getting up,1
the boy just wakes up and feels comfortable,0
a boy just get up,0
the boy is getting up,1
the boy get up,0
"waking up in his own bed, the man is happy with the beautiful weather",0
the boy just woke up and he's stretching,1
a boy is getting up,1
the boy is waking up by the clock ring,1
a man is waking up with the ring of alarm,1
a boy is getting up at morning,1
the clock is ringing and the boy wakes up,1
a boy is getting up when he listened clock,1
the boy is waking up,1
the boy is stretching himself on the bed,1
the boy is waking up so cheerfully because of the alarm,1
the man wakes up in the morning,0
a boy who sit on a bed and begin to get up,0
a man gets up after the alarm going,0
the boy is taking a nap,1
a boy woke up when the clock rang,0
the man get up at 1 pm,0
he is waking up,1
the boy just woke up,0
a boy just wake up in the morning,0
the boy is awake by the sound of his alarm,0
the man is getting up in the afternoon,1
the boy wakes up,0
the boy just gets up,0
the man is stretching his arms and legs,1
a boy just waked up by the alarm,0
the man is waking up,1
the boy is waking up and stretching his arms,1
the boy is stretching his body with the clock ringing,1
the boy is getting up because the alarm clock is ringing,1
the guy wakes up,0
a boy wakes up in a sunny day while his alarm clock is ringing,0
the boy just waked up,0
the boy is happy,0
the man gets up,0
the boy is wearing up,1
a boy is getting up with a big smile on his face while the alarm clock is ringing,1
the boy getting up from the bed at 2pm,1
he is getting up,1
the alarm clock wakes up the boy from sleeping,0
the boy is stretching after waking up in the morning,1
the boy wakes up when the alarm is ringing,0
the boy just weak up in the morning by the alert,0
he just woke up,0
the boy is stretching as he wakes up,1
it is morning,0
the alarm is going off and the young man is waking up,1
the young man is just waking up from a wonderful afternoon nap,1
the person is waking up,1
the alarm clock woke up the person,0
the human is stretching and smiling,1
the window is open,0
the boy is waking up to his alarm,1
the boy is ready to start his day,1
he is waking up to a new day,1
good morning sunshine. it's a beautiful day,0
wake up,0
emilio just woke up,0
it's going to be a great day,0
the man is waking up in am,1
a person enjoys rising in am,0
a boy with unusually long legs wakes up as an alarm rings,0
"an alarm, or perhaps a breeze, wakes up a bot from his slumber",0
the young man waking up from a long sleep,1
the young man waking up to a sunny bright day,1
man is waking up to alarm,1
man is getting ready for bed,1
a teenager is waking up,1
a person is stretching and smiling in bed,1
a person is waking up,1
an alarm is going off,1
a teen is waking up from a nap,1
the alarm is going off,1
a man is waking up,1
a man's alarm clock has gone off,0
waking up,0
a young boy getting up,1
the alarm clock woke the man up,0
the teenage boy is waking up to a bright sunny day,1
the boy wake felling refreshed to be able to sleep in until 1pm,0
the boy is waking up to a beautiful day,1
the alarm clock has awakened the boy on what appears to be a beautiful day,0
this young man is ready to start the day,1
this young man is getting ready to get out of bed and start his day,1
waking up to a new day,0
looking forward to a new day,0
a man is waking up from the sound of his alarm clock,1
stretch,0
"the alarm clock is ringing in the morning, and yet no one in this home is truly any different because during sleep we may change on a microscopic level, but, as a whole, we are essentially the same person we were when we went to bed the day before",1
alarm clock woke up some one,0
"sam happily awoke , stretching, to a alarm clock ringing",0
get up,0
get up now,0
the young boy is excited to wake up on such a sunny day,0
the breeze blows in to greet the young boy waking up,0
boy woke up just now,0
"just now, the boy woke up",0
the man gives a big stretch to help wake him up,0
an afternoon nap is so refreshing,0
time to wake up,0
its a new morning,0
the man has awoken from a long nap,0
"the alarm is going off, it is time to get up from his nap",1
a morning after a good night's sleep,0
time to go to work,0
a person is having a good morning stretch,1
the breeze is blowing on the person as he stretches upon waking,1
the boy is happy to wake up,0
"the boy's alarm clock went off, starting the day",0
a person woke up from sleep,0
a guy woke up at 10 o'clock,0
a smiling child stretches happily,0
"stretching with a smile, the child seems happy",0
a boy is waking up,1
the wind is blowing the curtains,1
the child is just waking up,1
this guy straightened up in bed,0
this guy just waking up,1
a child (with exceptionally long legs) is being wakened by an alarm clock,1
an alarm clock wakes a boy,0
he slept all day and feels good,0
that was a great night's sleep,0
a man is waking up in bed and stretching,1
a breeze from the window is waking the stretching man in bed,1
boy waking up,1
morning rise and shine,0
it is time to wake up,0
someone woke up refreshed and happy,0
an alarm is going off waking a boy,1
a boy is waking up at 2 p.m,1
a boy with bed hair is waking up late on a breezy afternoon,1
a boy is being woken up by an alarm clock,0
a boy is stretching as he sits up in bed,1
boy stretches getting ready for the day,5
his alarm clock woke him up,0
a man is waking up well rested to a balmy day,1
an alarm clock rings fruitlessly as its victim defies all tactics,0
guy waking up,1
guy in bed,0
the boy is waking,1
the alarm woke the boy,0
in bed,0
a boy is waking up for the morning,1
a boy who just woke up is stretching,1
the alarm is going off and it woke the man up,1
a person is waking up in the morning,1
the alarm clock is ringing and someone is waking up,1
the boy awakes with a stretch,0
the alarm clock wakes up the boy,0
just waking up,0
thoroughly enjoying this,0
the boy is stretching,1
"the alarm clock went off, so the boy is getting up for the day",1
the boy got a good night's sleep,0
the guy is waking up to start his day,1
the alarm clock is waking him from his restful night of sleep,1
the boy wakes up in the morning,0
the boy is woken up by his alarm clock,0
the alarm clock is ringing as the boy wakes up and stretches,1
it's morning and the boy is stretching,1
the alarm buzzes and the boy sits up in bed,0
the boy sits up in bed as the alarm buzzes,0
the alarm clock is going off,1
a person is waking up to an alarm,1
an alarm is waking a person,1
"after a restful sleep, a boy is awakening to a sunny day",1
"on vacation, a boy slept until the alarm clock awakened him in the afternoon",0
a boy awakens from an afternoon nap,0
a person sits up in bed,0
the boy is unusually glad to get up at the sound of the alarm clock,0
the boy appears to have unusually long legs,0
he wakes up with a smile on his face,0
"good morning, time to wake up",0
the alarm clock is ringing,1
the young man is waking up from a long nites rest,1
"the boy awakes, ready to face the day",0
a fresh start,0
the boy stretches in his bed,0
the young man awakens to the sunbeams striking him with their stimulating light,0
"the alarm clock alerts the sleeper that the morning has dawned, ergo he is obligated to ready himself for work",0
he woke up in his bed,0
"in his bed, he woke up",0
the boy is waking up happy,1
stretching after waking up makes this boy happy,0
a boy is awake,0
a boy moves his arms,0
that boy sleeps late,0
a person is waking from a nap,1
a man is waking up in the afternoon,1
"the alarm is going off, waking up the person",1