Source,Response,A1,A2
I01T_Verif,the boy is dancing to the music,1,1
I01T_Verif,the boy enjoys the music playing,1,1
I01T_Verif,the boy is dancing,1,1
I01T_Verif,the boy is really enjoying the party,0,0
I01T_Verif,he is dancing to music,1,1
I01T_Verif,he is dancing,1,1
I01T_Verif,dancing to music,1,1
I01T_Verif,fcx,0,0
I01T_Verif,the boy is listening to music,1,1
I01T_Verif,the happy boy is smiling as he dances,1,1
I01T_Verif,this boy is dancing vigorously,1,1
I01T_Verif,the boy is listening to his favorite song,0,0
I01T_Verif,he is listening to music,1,1
I01T_Verif,the boy is dancing to music,1,1
I01T_Verif,dancing,1,1
I01T_Verif,he is doing a happy dance,1,1
I01T_Verif,clebrating a great report card,0,0
I01T_Verif,this boy is dancing,1,1
I01T_Verif,the boy is having a good time,1,1
I01T_Verif,he is dancing to the music,1,1
I01T_Verif,grooving to music,1,1
I01T_Verif,how the hell should i know,0,0
I01T_Verif,the boy is listening to music and dancing,1,1
I01T_Verif,he is enjoying his music,1,1
I01T_Verif,having fun,1,1
I01T_Verif,he is a dancing machine,1,1
I01T_Verif,he's dancing to music,1,1
I01T_Verif,a child is having fun,1,1
I01T_Verif,the boy is jiving,1,1
I01T_Verif,exercising to music,0,0
I01T_Verif,the boy is having fun,1,1
I01T_Verif,he enjoys dancing to music,1,1
I01T_Verif,the boy is celebrating,0,0
I01T_Verif,the kid is grooving,1,1
I01T_Verif,the boy is dancing a jig,0,0
I01T_Verif,the boy is enjoying himself,1,1
I01T_Verif,he's rocking out,1,1
I01T_Verif,he's grooving,1,1
I01T_Verif,this boy is enjoying the music,1,1
I01T_Verif,getting his groove on,1,1
I01T_Verif,this boy appears to be dancing,1,1
I01T_Verif,this man appears to be dancing because he is happy,1,1
I01T_Verif,the boy is dancing happily,1,1
I01T_Verif,the boy is listening to music while happily dancing,1,1
I01T_Verif,he's dancing,1,1
I01T_Verif,the boy is getting down,1,1
I01T_Verif,danceing,1,1
I01T_Verif,the music is enticing the boy to dance,1,1
I01T_Verif,the boy is dancing to the rythm,1,1
I01T_Verif,he's doing a happy dance,1,1
I01T_Verif,he's enjoying the song,1,1
I01T_Verif,have fun,1,1
I01T_Verif,do dance,1,1
I01T_Verif,the lad is dancing,1,1
I01T_Verif,the young man is joyous,1,1
I01T_Verif,the boy likes music,1,1
I01T_Verif,enjoying music,1,1
I01T_Verif,he is having a good time,1,1
I01T_Verif,the boy appears to be dancing,1,1
I01T_Verif,the boy appears to be moving his body in time to music,1,1
I01T_Verif,the boy is dancing with the music,1,1
I01T_Verif,the boy is dancing by following the music,1,1
I01T_Verif,the boy is dancing with music,1,1
I01T_Verif,a boy is dancing with music,1,1
I01T_Verif,dancing with music,1,1
I01T_Verif,this boy is dancing with music,1,1
I01T_Verif,a boy is dancing,1,1
I01T_Verif,the man is dancing with music,1,1
I01T_Verif,the boy is dancing accompanying with music,1,1
I01T_Verif,the boy is dancing along the music,1,1
I01T_Verif,a young man is dancing with the music on,1,1
I01T_Verif,a young boy is dancing along with music,1,1
I01T_Verif,the smiling boy is dancing with music,1,1
I01T_Verif,the boy dances with music on,1,1
I01T_Verif,a boy is dancing along with music,1,1
I01T_Verif,the young man has become filled with the joy of music and he flails to its rhythm,1,1
I01T_Verif,he is having a seizure,0,0
I01T_Verif,he is having a great time listening to music,1,1
I01T_Verif,he is moving to the music,1,1
I01T_Verif,the boy is one with the music,1,1
I01T_Verif,he is enjoying music,1,1
I01T_Verif,the boy is partying,0,0
I01T_Verif,the young man is dancing,1,1
I01T_Verif,the boy is grooving to the music,1,1
I01T_Verif,the boy is totally jamming out,1,1
I01T_Verif,a boy is moving to the beat of music,1,1
I02T_Verif,the boy is eating pizza,1,1
I02T_Verif,the boy is getting ready to bite into the pizza,1,1
I02T_Verif,the boy looks happy to have that slice of pie,1,1
I02T_Verif,he is about to eat a slice of pizza,1,1
I02T_Verif,"eating pizza, yum",1,1
I02T_Verif,the boy is about to eat a piece of pizza,1,1
I02T_Verif,hoj,0,0
I02T_Verif,gub,0,0
I02T_Verif,the boy is ready to gobble the pizza,1,1
I02T_Verif,he is eating pizza,1,1
I02T_Verif,the not is happy to eat pizza,0,0
I02T_Verif,the boy is about to take a bite from a slice of plain pizza,0,0
I02T_Verif,eating pizza,1,1
I02T_Verif,the boy is eating a slice pizza,1,1
I02T_Verif,the boy is eating,1,1
I02T_Verif,eating pizza makes the boy happy,1,1
I02T_Verif,the boy is about to eat a slice of pizza,1,1
I02T_Verif,he is enjoying a piece of pizza,1,1
I02T_Verif,this boy is eating a piece of pizza,1,1
I02T_Verif,the kid is eating a slice of meatball pizza,0,0
I02T_Verif,he is eating a slice of pizza,1,1
I02T_Verif,this boy loves pizza,1,1
I02T_Verif,do you think he like's pizza?,0,0
I02T_Verif,he may get fat eating pizza,0,0
I02T_Verif,this boy really likes pizza,1,1
I02T_Verif,ready to eat pizza,1,1
I02T_Verif,tasting pizza,1,1
I02T_Verif,eatting,1,1
I02T_Verif,see my last statement,0,0
I02T_Verif,the boy likes pizza,1,1
I02T_Verif,the boy is about to eat a pizza,1,1
I02T_Verif,the boy is about to enjoy some pizza,1,1
I02T_Verif,the boy enjoys pizza,1,1
I02T_Verif,the little boy is eating pizza,1,1
I02T_Verif,he is eating food,1,1
I02T_Verif,the kid is eating pizza,1,1
I02T_Verif,the boy is looking forward to enjoying pizza,1,1
I02T_Verif,getting ready to take a bite of pizza,1,1
I02T_Verif,excited about his slice of pizza,1,1
I02T_Verif,the b,0,0
I02T_Verif,about to go deep on a pizza slice,1,1
I02T_Verif,consuming mad calories,0,0
I02T_Verif,he is enjoying some pizza,1,1
I02T_Verif,eating,1,1
I02T_Verif,the boy is enjoying pizza,1,1
I02T_Verif,the child is about to eat pizza,1,1
I02T_Verif,the kid is going to eat a slice of pizza,1,1
I02T_Verif,about to eat pizza,1,1
I02T_Verif,he is taking a bite of pizza,1,1
I02T_Verif,the boy is taking a bite out of a slice of pizza,1,1
I02T_Verif,he's pigging out,0,0
I02T_Verif,he's scarfing down a pizza,1,1
I02T_Verif,pizza is this boys favorite food,0,0
I02T_Verif,this young man is enjoying his cheese pizza,0,0
I02T_Verif,this boy is eating pizza,1,1
I02T_Verif,boy is enjoying a pizza,1,1
I02T_Verif,he's stuffing his face,1,1
I02T_Verif,the boy is eating a slice of pizza,1,1
I02T_Verif,the boy is anxiously awaiting for the pizza to enter his mouth,1,1
I02T_Verif,the boy is eating pepperoni pizza,0,0
I02T_Verif,he is consuming a slice of pizza,1,1
I02T_Verif,he's eating pizza,1,1
I02T_Verif,the boy is having a slice of pizza,1,1
I02T_Verif,enjoying it,0,0
I02T_Verif,the boy is ready to take a bite out of a piece of pizza,1,1
I02T_Verif,he's looking forward to eating the pizza,1,1
I02T_Verif,his mouth is watering,0,0
I02T_Verif,eat sausage,0,0
I02T_Verif,hungry,0,0
I02T_Verif,the child is enjoying a snack,0,0
I02T_Verif,the boy is going to eat a slice of pizza,1,1
I02T_Verif,the boy is holding a slice of pizza,1,1
I02T_Verif,the boy is having lunch,1,1
I02T_Verif,he is looking at the pizza,1,1
I02T_Verif,enjoying pizza,1,1
I02T_Verif,the boy is standing eating pizza,1,1
I02T_Verif,while standing up,0,0
I02T_Verif,the boy appears to be getting ready to bite in to a slice of pizza,1,1
I02T_Verif,the boy appears to be savoring his first bite of a slice of pizza,1,1
I02T_Verif,the boy is eating a piece of pizza,1,1
I02T_Verif,the boy is taking a bite from a slice of pizza,1,1
I02T_Verif,a little boy is eating a pizza,1,1
I02T_Verif,the boy is eating a delicious pizza,1,1
I02T_Verif,the boy enjoys his pizza,1,1
I02T_Verif,the little kid is enjoying the pizza,1,1
I02T_Verif,a baby is eating pizza,0,0
I02T_Verif,this boy is eating a pizza,1,1
I02T_Verif,he is eating,1,1
I02T_Verif,a boy is eating pizza,1,1
I02T_Verif,the boy is eating a pizza,1,1
I02T_Verif,the child is eating pizza,1,1
I02T_Verif,he is eating a pizza,1,1
I02T_Verif,the boy is eating the pizza,1,1
I02T_Verif,the boy is eating the piece of pizza,1,1
I02T_Verif,the boy is eating a piece of the pizza,1,1
I02T_Verif,he is eating a piece of pizza,1,1
I02T_Verif,the boy is eating a pizza slice,1,1
I02T_Verif,he is eating the pizza,1,1
I02T_Verif,a little boy is eating a piece of pizza,1,1
I02T_Verif,a fat kid is eating a delicious pizza,0,0
I02T_Verif,the child is about to eat a slice of pizza,1,1
I02T_Verif,a short boy is going to eat a pepperoni pizza,0,0
I02T_Verif,this boy is preparing to eat the delicious pizza,1,1
I02T_Verif,a boy is trying to eat a pizza,1,1
I02T_Verif,the kid is eating the pizza,1,1
I02T_Verif,the boy is having a bite of pizza,1,1
I02T_Verif,how is the pizza staying perfectly horizontal when the boy is holding it so close to the tip?,0,0
I02T_Verif,the boy is enjoying food,1,1
I02T_Verif,he is about to take a bite of pizza,1,1
I02T_Verif,he is about to chow down on some pizza,1,1
I02T_Verif,the boy is viewing the food he is about to ingest,1,1
I02T_Verif,he is getting ready to take a bite of pizza,1,1
I02T_Verif,the boy is biting a piece of pizza,1,1
I02T_Verif,the boy is gleefully enjoying a slice of pizza,1,1
I02T_Verif,the boy is excited to eat pizza,1,1
I02T_Verif,the boy has his mouth open to consume pizza,1,1
I03T_Verif,the man is delivering the package,1,1
I03T_Verif,the woman is accepting the package delivery,1,1
I03T_Verif,the man is delivering a package,1,1
I03T_Verif,t.he man is accepting a package,1,1
I03T_Verif,the man is handing the woman a package,1,1
I03T_Verif,he is delivering a box,1,1
I03T_Verif,the woman is receiving a package,1,1
I03T_Verif,bgrdydth,0,0
I03T_Verif,hfdn,0,0
I03T_Verif,the man is handing over the package,1,1
I03T_Verif,he is delivering a package,1,1
I03T_Verif,he is handing a package to a woman,1,1
I03T_Verif,a man is handing a small brown package to a woman seated at a desk,1,1
I03T_Verif,delivering a package,1,1
I03T_Verif,the man is delivering package to the woman,1,1
I03T_Verif,the woman has handed a package to a man who is picking it up for delivery,1,1
I03T_Verif,this guy is delivering a package,1,1
I03T_Verif,that guy is dropping off a package,1,1
I03T_Verif,woman receiving package,1,1
I03T_Verif,the man is delivering a package to the receptionist,1,1
I03T_Verif,a young man will mail a package for you,0,0
I03T_Verif,he is delivering a package to the receptionist,1,1
I03T_Verif,handing the secretary a package,1,1
I03T_Verif,giving woman a package,1,1
I03T_Verif,"she is taking it lol-god, this is stupid",0,0
I03T_Verif,the man is handing a package to the secretary,1,1
I03T_Verif,the man is picking up a package,1,1
I03T_Verif,the man is delivering a package to the woman,1,1
I03T_Verif,he is handing a box to the woman at the desk,1,1
I03T_Verif,the man is handing her mail,1,1
I03T_Verif,the man is giving the woman a piece of mail,1,1
I03T_Verif,he gave the package to the lady at the desk,1,1
I03T_Verif,he is handing the woman a package,1,1
I03T_Verif,the delivery man hands the lady a box,1,1
I03T_Verif,the woman is taking a delivery,1,1
I03T_Verif,the man is handing a package to the woman,1,1
I03T_Verif,the woman is handing a package to the man,1,1
I03T_Verif,handing the girl a package,1,1
I03T_Verif,taking a package from the girl,1,1
I03T_Verif,the man is a courier,1,1
I03T_Verif,delivering his package,1,1
I03T_Verif,providing the female with a delivery,1,1
I03T_Verif,the man delivers a package,1,1
I03T_Verif,the man hands a delivery to the woman,1,1
I03T_Verif,handing over a package,1,1
I03T_Verif,the man is picking up a package to deliver,1,1
I03T_Verif,the delivery man is handing the woman a package,1,1
I03T_Verif,he is dropping a package off at its location,1,1
I03T_Verif,the man is giving a package to the woman,1,1
I03T_Verif,he's giving her a box,1,1
I03T_Verif,the delivery man is dropping off a package,1,1
I03T_Verif,this man is making a special delivery to the office,1,1
I03T_Verif,giving her a package,1,1
I03T_Verif,this man is delivering a package,1,1
I03T_Verif,this man is presenting a package to the woman,1,1
I03T_Verif,the man is admiring the woman,0,0
I03T_Verif,the man is delivering a package to the receptionist of a well known law office,0,0
I03T_Verif,the man is delivering a package to a woman,1,1
I03T_Verif,the delivery man is giving the lady a package,1,1
I03T_Verif,the secretary is receiving a pakage,1,1
I03T_Verif,the delivery man is handing a package to the lady,1,1
I03T_Verif,he's delivering a package,1,1
I03T_Verif,the man is handing a package to the young lady,1,1
I03T_Verif,delivering drugs,0,0
I03T_Verif,dropping off sexual gadgets,0,0
I03T_Verif,delivering package,1,1
I03T_Verif,to da gril,0,0
I03T_Verif,the woman is taking a package from the man,1,1
I03T_Verif,the man is giving and delivering a box to the lady,1,1
I03T_Verif,he's picking up a package,1,1
I03T_Verif,gift,0,0
I03T_Verif,eat,0,0
I03T_Verif,the delivery man has arrived,1,1
I03T_Verif,a man delivered your package,0,0
I03T_Verif,delivery man is delivering a package,1,1
I03T_Verif,the receptionist is receiving a package,1,1
I03T_Verif,the man is flirting with the woman,0,0
I03T_Verif,taking a package from the woman,1,1
I03T_Verif,delivering a package to the woman,1,1
I03T_Verif,handing the lady a package,1,1
I03T_Verif,the is returning a package,0,0
I03T_Verif,delivering a box,1,1
I03T_Verif,to a women,0,0
I03T_Verif,the man appears to be in the process of handing a package to a lady behind a desk,1,1
I03T_Verif,the man appears to be delivering a package,1,1
I03T_Verif,the man is delivering package,1,1
I03T_Verif,the man is giving the package to the woman,1,1
I03T_Verif,the man is giving a package to a woman,1,1
I03T_Verif,the man is giving the box to the woman,1,1
I03T_Verif,the man is delivering the package to the woman,1,1
I03T_Verif,the man delivered one package to one female staff,1,1
I03T_Verif,the man is giving a delivery to a woman,1,1
I03T_Verif,the man is passing the package to the lady,1,1
I03T_Verif,a package is delivered,1,1
I03T_Verif,the man is handling a mailbox to the woman,0,0
I03T_Verif,he is giving the package to the woman,1,1
I03T_Verif,a man is passing a box to a young lady,1,1
I03T_Verif,the man is helping the girl to pick up her package,0,0
I03T_Verif,the postman is giving a package to the lady,1,1
I03T_Verif,his is handing the woman a package,1,1
I03T_Verif,the man give a gift to female,0,0
I03T_Verif,he is sending the gift for the women,0,0
I03T_Verif,the officer is receiving the package from the postman,0,0
I03T_Verif,the man is giving the package to the female officer,0,0
I03T_Verif,the man is delivering,1,1
I03T_Verif,the man is passing a package to the woman,1,1
I03T_Verif,the man is handing a box to the lady,1,1
I03T_Verif,he is giving a box to the girl,1,1
I03T_Verif,the girl gets her package,1,1
I03T_Verif,the man is handing a box to a woman,1,1
I03T_Verif,the young man is giving a box to a young lady,1,1
I03T_Verif,he is delivering a package to a woman,1,1
I03T_Verif,he is passing a box to a woman,1,1
I03T_Verif,the man is giving a box to a woman,1,1
I03T_Verif,the man is handing over a package to the lady,1,1
I03T_Verif,a delivery man is delivering a red package to center desk,0,0
I03T_Verif,the man is giving a woman a gift,0,0
I03T_Verif,a woman is receiving a package from a mail person,1,1
I03T_Verif,the woman is receiving a box from a man,1,1
I03T_Verif,he is passing a package to the woman,1,1
I03T_Verif,the man is delivered the package,1,1
I03T_Verif,a woman is taking a package from a man,1,1
I03T_Verif,the man is passing a package to a sitting office lady,1,1
I03T_Verif,the poster officer is giving a package to a woman,1,1
I03T_Verif,he is giving the package to the young lady,1,1
I03T_Verif,the boy give the girl a brown box,1,1
I03T_Verif,the deliver is handing the package to the woman,1,1
I03T_Verif,the woman get a package,1,1
I03T_Verif,he is handing a package,1,1
I03T_Verif,he is passing the box to the girl,1,1
I03T_Verif,the man is handing package to the woman,1,1
I03T_Verif,he's handing the woman a package,1,1
I03T_Verif,"as the man hands the package to the woman, their eyes meet and a passionate romance ensues",0,0
I03T_Verif,he is presenting a gift,0,0
I03T_Verif,he is handing the woman a box,1,1
I03T_Verif,he is dropping off a package,1,1
I03T_Verif,the mailman is delivering a package to the receptionist,1,1
I03T_Verif,the man is feeling a sort of romantic feeling for the woman in front of him,0,0
I03T_Verif,the man is handing a packing to the lady,1,1
I03T_Verif,he is handing a package to the woman,1,1
I03T_Verif,the man is giving the woman a package,1,1
I03T_Verif,the man is making a package delivery to an office,1,1
I03T_Verif,he's handing a box to the lady,1,1
I03T_Verif,the man is handing over a package to recipient,1,1
I03T_Verif,he is handing a lady a box,1,1
I03T_Verif,the man is delivering a package to a woman in an office,1,1
I03T_Verif,the man is giving a parcel to a lady,1,1
