Source,Response,A1,A2
I01U_Verif,the boy is dancing to the music,1,1
I01U_Verif,the music is making the boy want to dance,1,1
I01U_Verif,a young male is dancing,1,1
I01U_Verif,a boy is moving to music,1,1
I01U_Verif,the boy is dancing,1,1
I01U_Verif,the boy likes music,1,1
I01U_Verif,the boy is listening to music,1,1
I01U_Verif,a guy is dancing,1,1
I01U_Verif,the young boy is dancing to music,1,1
I01U_Verif,the music makes the young boy smile,1,1
I01U_Verif,a boy is dancing to music,1,1
I01U_Verif,the music makes the boy dance,1,1
I01U_Verif,an adolescent is dancing merrily to some music,1,1
I01U_Verif,the music is stirring up the man's exhilaration to exercise to the rhythm,0,0
I01U_Verif,the boy is dancing to music,1,1
I01U_Verif,music fills the air and makes the boy happy,1,1
I01U_Verif,the teen is dancing to music,1,1
I01U_Verif,the boy is happy,1,1
I01U_Verif,the boy is being attacked by music notes,0,0
I01U_Verif,dancing with a boy,0,0
I01U_Verif,stoner,0,0
I01U_Verif,music is playing,1,1
I01U_Verif,"while music plays, the boy dances",1,1
I01U_Verif,this boy dances to music,1,1
I01U_Verif,the music inspires this boy to dance,1,1
I01U_Verif,music moves a young man's feet,1,1
I01U_Verif,"while listening to music, a boy is moving to the beat",1,1
I01U_Verif,music is inspiring a boy to move,1,1
I01U_Verif,the boy is jamming to some music,1,1
I01U_Verif,the boy is dancing like no one is watching,1,1
I01U_Verif,a young man in dancing,1,1
I01U_Verif,the young man dances,1,1
I01U_Verif,music is playing and a boy is dancing,1,1
I01U_Verif,a boy is dancing to some music,1,1
I01U_Verif,the music is causing the boy to dance,1,1
I01U_Verif,a boy is enjoying music,1,1
I01U_Verif,the guy is dancing to music,1,1
I01U_Verif,he is doing a happy dance to the music,1,1
I01U_Verif,a little boy is dancing to some music he enjoys,1,1
I01U_Verif,the little boy is dancing to enjoyable music and is having fun,1,1
I01U_Verif,he is dancing,1,1
I01U_Verif,having a great time,1,1
I01U_Verif,a teenager is rocking out,1,1
I01U_Verif,young man is dancing to music,1,1
I01U_Verif,music is playing and a man is dancing,1,1
I01U_Verif,there is music playing and the boy is dancing to it,1,1
I01U_Verif,a boy is listening and dancing to music,1,1
I01U_Verif,dancing,1,1
I01U_Verif,music playing,1,1
I01U_Verif,he is listening to music,1,1
I01U_Verif,boy dancing,1,1
I01U_Verif,happy boy,1,1
I01U_Verif,a man is dancing to music,1,1
I01U_Verif,a riling beat is moving a man to dance,1,1
I01U_Verif,"a boy is dancing, while listening to music",1,1
I01U_Verif,"music is playing, while a boy is dancing",1,1
I01U_Verif,music is playing and a boy is dancing to it,1,1
I01U_Verif,there is a boy dancing to music,1,1
I01U_Verif,a boy is getting lost in some music,1,1
I01U_Verif,a preteen boy is dancing to contemporary music,0,0
I01U_Verif,a boy in a blu shirt and gray pants is dancing,1,1
I01U_Verif,a boy is dancing,1,1
I01U_Verif,a blonde boy is dancing to music,1,1
I01U_Verif,the music makes the boy happy and he dances,1,1
I01U_Verif,boy is dancing to music,1,1
I01U_Verif,music is being played so boy can dance,1,1
I01U_Verif,a boy enjoys music,1,1
I01U_Verif,this is a man dancing to music,1,1
I01U_Verif,the sound of music is making the man dance,1,1
I01U_Verif,it is fun to dance,0,0
I01U_Verif,a young boy is dancing to music,1,1
I01U_Verif,a boy is dancing while listening to music,1,1
I01U_Verif,this guy dancing,1,1
I01U_Verif,the guy is dancing,1,1
I01U_Verif,the guy is happy,1,1
I01U_Verif,a boy is dancing to the music,1,1
I01U_Verif,music surrounds the dancing boy,1,1
I01U_Verif,the young man is dancing to music,1,1
I01U_Verif,a guy is dancing to his favorite music,0,0
I01U_Verif,a person enjoying listening to music,1,1
I01U_Verif,the boy is grooving to the music,1,1
I01U_Verif,a red-headed young man is dancing,1,1
I01U_Verif,a teenager is dancing with joy,1,1
I01U_Verif,a kid is dancing to music,1,1
I01U_Verif,a kid is very happy,1,1
I01U_Verif,the wonderful rhythms and sounds make the boy dance,1,1
I01U_Verif,music gets the boy dancing,1,1
I01U_Verif,this boy loves his music,1,1
I01U_Verif,this song makes me happy,0,0
I01U_Verif,the boy listening to music,1,1
I01U_Verif,the young boy is grooving to the music,1,1
I01U_Verif,the music is making the boy dance his heart out,1,1
I01U_Verif,dancing well,0,0
I01U_Verif,a boy is hip hop dancing to loud music,0,0
I01U_Verif,"a boy is enjoying loud music, dancing and enjoying life",1,1
I01U_Verif,the teen is dancing,1,1
I01U_Verif,the teen is enjoying music,1,1
I01U_Verif,singing,0,0
I01U_Verif,a man is moving to music,1,1
I01U_Verif,music has taken over this boys body,1,1
I01U_Verif,a guy is dancing to some music,1,1
I01U_Verif,this guy is really feeling the music,1,1
I01U_Verif,the music makes the boy happy and excited,1,1
I01U_Verif,"the boy's favorite song came on the radio, and he could not help but to dance to it",0,0
I01U_Verif,the boy is listening to music & dancing,1,1
I01U_Verif,dancing to music having fun,1,1
I01U_Verif,this boy is having a great time dancing,1,1
I01U_Verif,there is music playing,1,1
I01U_Verif,there is music playing and a boy is dancing,1,1
I01U_Verif,boy is dancing,1,1
I01U_Verif,boy is happy,1,1
I01U_Verif,the young man and dancing to the music,1,1
I01U_Verif,the young man having a good time dancing to the song,1,1
I01U_Verif,a young man is moving to music,1,1
I01U_Verif,a boy is happy when dancing,1,1
I01U_Verif,"andy loves the music, it makes him dance",0,0
I01U_Verif,dont know,0,0
I01U_Verif,the boy is doing a happy dance,1,1
I01U_Verif,the man is dancing,1,1
I01U_Verif,the boy is listening to music and dancing,1,1
I01U_Verif,the boy is dancing on music,1,1
I01U_Verif,the boy is dancing with the music alone,1,1
I01U_Verif,the boy is dancing with music,1,1
I01U_Verif,he is dancing with the music,1,1
I01U_Verif,a boy is dancing along the music,1,1
I01U_Verif,the boy is dancing with the music,1,1
I01U_Verif,the boy is dancing excitedly with loud and crazy music,0,0
I01U_Verif,the boy is listening to song and dancing at the same time,1,1
I01U_Verif,the boy is dancing to a music,1,1
I01U_Verif,he is dancing to the beat,1,1
I01U_Verif,the boy is dancing with some music,1,1
I01U_Verif,a man is dancing with music,1,1
I01U_Verif,the boy who in blue is dancing,1,1
I01U_Verif,the man is dancing while listening music,1,1
I01U_Verif,the boy is dancing so happily,1,1
I01U_Verif,a boy is dancing with music,1,1
I01U_Verif,the boy's dancing to the music,1,1
I01U_Verif,"the man is singing and dancing, because he is happy",0,0
I01U_Verif,the man is dancing with song,1,1
I01U_Verif,the boring is dancing while listening to music,0,0
I01U_Verif,a boy is dancing with pop music,0,0
I01U_Verif,a boy is dancing around with his smile on his face,1,1
I01U_Verif,the boy is enjoying music and is trying to keep beat to the music,1,1
I01U_Verif,he enjoys moving to the music,1,1
I01U_Verif,he loves music,1,1
I01U_Verif,music makes the kid happy,1,1
I01U_Verif,this kid is dancing,1,1
I01U_Verif,the music is making the boy dance,1,1
I01U_Verif,the boy is having fun listening to music,1,1
I01U_Verif,the music made the boy want to dance,1,1
I01U_Verif,the guy is dancing to the music,1,1
I02U_Verif,the boy is eating pizza,1,1
I02U_Verif,pizza is being eating by the boy,1,1
I02U_Verif,a child is eating a slice of pizza,1,1
I02U_Verif,a young boy is eating pizza,1,1
I02U_Verif,the boy likes pizza,1,1
I02U_Verif,the boy is eating a piece of pizza,1,1
I02U_Verif,the boy is excited about the size of the pizza,0,0
I02U_Verif,a boy is eating pizza,1,1
I02U_Verif,a boy is smiling,1,1
I02U_Verif,the boy can not wait to eat pizza,1,1
I02U_Verif,pizza makes the boy happy,1,1
I02U_Verif,timmy is eating pizza,0,0
I02U_Verif,the pizza is eaten by timmy,0,0
I02U_Verif,a lad is ready to take a bite of a slice of pizza,1,1
I02U_Verif,the child is pausing ere he eats the (pizza) pie realizing it needs a condiment to taste even more toothsome,0,0
I02U_Verif,the boy eats are large piece of pizza,1,1
I02U_Verif,a young boy has a big appetite,0,0
I02U_Verif,the child is eating pizza,1,1
I02U_Verif,this boy is happily eating,1,1
I02U_Verif,the boy is eating a slice of pizza,1,1
I02U_Verif,the boy is about to partake of a slice of pizza,1,1
I02U_Verif,that boy is about to eat the pizza,1,1
I02U_Verif,a boy is eating a slice of pizza,1,1
I02U_Verif,a slice of pizza is being eaten by a boy,1,1
I02U_Verif,this boy is about to eat a slice of pizza,1,1
I02U_Verif,this pizza slice will soon disappear,0,0
I02U_Verif,a youngster anticipates the taste of pizza,1,1
I02U_Verif,a boy is about to bite a piece of pizza,1,1
I02U_Verif,"eager with anticipation born from scheduled pizza on the menu, a boy is salivating to begin eating",0,0
I02U_Verif,a boy is enjoying a slice of pizza,1,1
I02U_Verif,a piece of pizza is being eaten by a boy,1,1
I02U_Verif,the boy is chowing down,1,1
I02U_Verif,the boy eats pizza,1,1
I02U_Verif,the boy in the picture is enjoying a slice of pizza,1,1
I02U_Verif,the little boy is eating a slice of pizza,1,1
I02U_Verif,a slice of pizza is being eaten by a little boy,1,1
I02U_Verif,a child is about to eat a piece of pizza,1,1
I02U_Verif,he loves eating pizza,1,1
I02U_Verif,most kids like to eat pizza,0,0
I02U_Verif,the boy's eating his favorite food,0,0
I02U_Verif,the little boy decided to eat pizza for lunch,0,0
I02U_Verif,the boy enjoys pizza,1,1
I02U_Verif,eating pizza,0,0
I02U_Verif,thoroughly enjoying this,0,0
I02U_Verif,a blonde boy with freckles is eating a slice of pizza,1,1
I02U_Verif,the freckled boy is excited to taste this slice of pizza,1,1
I02U_Verif,boy is eating pizza,1,1
I02U_Verif,pizza is being eaten by a young boy,1,1
I02U_Verif,the pizza is being eaten by a boy,1,1
I02U_Verif,a boy is about to enjoy eating a slice of pizza,1,1
I02U_Verif,little boy,0,0
I02U_Verif,the boy eats the pizza,1,1
I02U_Verif,the pizza is eaten by the boy,1,1
I02U_Verif,the child is going to bite the pizza,1,1
I02U_Verif,littler. it eating pizza,0,0
I02U_Verif,guy eating pizza,1,1
I02U_Verif,a little boy is joyously eating a slice of pizza,1,1
I02U_Verif,a slice of pizza is about to be eaten by a little boy,1,1
I02U_Verif,a boy was given pizza to eat,0,0
I02U_Verif,a boy is starting to eat s slice of pizza,1,1
I02U_Verif,a boy is about to bite into a slice of pizza,1,1
I02U_Verif,a young boy wearing tennis shoes is eating pizza,1,1
I02U_Verif,a child is eating pizza,1,1
I02U_Verif,pizza is being eaten by a child,1,1
I02U_Verif,pepperoni pizza makes the boy smile,0,0
I02U_Verif,child is eating pizza,1,1
I02U_Verif,pizza is what the child is eating,1,1
I02U_Verif,the kid eats pizza,1,1
I02U_Verif,a boy is taking a bite of pizza,1,1
I02U_Verif,the happy boy is going to take a bite of pizza,1,1
I02U_Verif,a slice of pizza is going to be a meal for a boy,1,1
I02U_Verif,he is hungry for pizza,1,1
I02U_Verif,at lunch time the boy ate a slice of pizza,0,0
I02U_Verif,this eating pizza,0,0
I02U_Verif,this guy having a pizza,1,1
I02U_Verif,the child is hungry,1,1
I02U_Verif,the child is about to eat a piece of pizza,1,1
I02U_Verif,pizza is being eaten by a boy,1,1
I02U_Verif,a little boy is about to bite a slice of pizza,1,1
I02U_Verif,a slice of pizza is about to have a bite taken by a boy,1,1
I02U_Verif,the boys take a bite out of the pizza,0,0
I02U_Verif,a kid is eating a slice of pizza,1,1
I02U_Verif,the boy is about to take a big bite out of the pizza,1,1
I02U_Verif,a young boy is about to bite into a pizza,1,1
I02U_Verif,a freckled child is eating a pizza,1,1
I02U_Verif,a kid is just about to eat some pizza,1,1
I02U_Verif,pizza is this boy's favorite food,0,0
I02U_Verif,the boy loves pizza,1,1
I02U_Verif,this boy is enjoying a slice of pizza,1,1
I02U_Verif,a boy eats pizza,1,1
I02U_Verif,boy eating pizza,1,1
I02U_Verif,pizza eaten by a boy,1,1
I02U_Verif,crosby can't wait to take a bite of the pizza,0,0
I02U_Verif,timmy loves pizza,0,0
I02U_Verif,eating pizza happily,0,0
I02U_Verif,a child is eating a slice of pepperoni pizza,0,0
I02U_Verif,a small boy is happily munching on a slice of pepperoni pie,0,0
I02U_Verif,a slice of pizza is being eaten,1,1
I02U_Verif,eating,0,0
I02U_Verif,pizza,0,0
I02U_Verif,kid is eating pizza,1,1
I02U_Verif,he is eating a slice of pizza,1,1
I02U_Verif,a little boy is eating a slice of pizza,1,1
I02U_Verif,a child is about to enjoy a slice of pizza,1,1
I02U_Verif,a child is happy about eating his favorite food,0,0
I02U_Verif,this little kid is enjoying a pizza,1,1
I02U_Verif,this little boy is about to enjoy a slice of pizza,1,1
I02U_Verif,pizza is the boy's favorite food,0,0
I02U_Verif,the boy is enjoying a slice of pizza,1,1
I02U_Verif,the boy is about to take a bite of pizza,1,1
I02U_Verif,the boy is about to eat a piece of pizza,1,1
I02U_Verif,the boy loves to eat pizza,1,1
I02U_Verif,a little boy eating pizza,1,1
I02U_Verif,having pizza,0,0
I02U_Verif,a boy is about to eat pizza,1,1
I02U_Verif,the kids show love pizza,0,0
I02U_Verif,pizza is making this young man happy,1,1
I02U_Verif,a kid is eating pizza,1,1
I02U_Verif,tommy is eating pizza,0,0
I02U_Verif,pizza is tommy's favorite food,0,0
I02U_Verif,eat,0,0
I02U_Verif,food,0,0
I02U_Verif,the kid''s eating pizza,1,1
I02U_Verif,the kid is fixin' to eat a piece of pizza,1,1
I02U_Verif,the little boy is eating the pizza,1,1
I02U_Verif,the boy is eating his pizza,1,1
I02U_Verif,a boy is eating a piece of pizza,1,1
I02U_Verif,the boy is having a slide of pizza,1,1
I02U_Verif,he is eating pizza,1,1
I02U_Verif,the boy is going to eat a delicious pizza,1,1
I02U_Verif,a little boy is having a slice of pizza,1,1
I02U_Verif,the boy is hungry,1,1
I02U_Verif,the boy is eating the pizza,1,1
I02U_Verif,the boy is eating a pizza,1,1
I02U_Verif,the boy is eating,1,1
I02U_Verif,the little boy is eating a whole piece of pizza,1,1
I02U_Verif,the boy is preparing to eat a pepperoni pizza,0,0
I02U_Verif,the boy is trying to eat a piece of pizza,1,1
I02U_Verif,a boy is eating a pizza,1,1
I02U_Verif,the little boy is having a piece of pizza,1,1
I02U_Verif,a lovely boy eats a pizza,1,1
I02U_Verif,a boy is putting a piece of pizza in his mouth,1,1
I02U_Verif,the boy is about to eat the pizza,1,1
I02U_Verif,he is eating a pizza,1,1
I02U_Verif,the little boy is eating a piece of pizza,1,1
I02U_Verif,a boy is having pizza,1,1
I02U_Verif,a boy who wear a green t-shirt is eating a piece of pizza,1,1
I02U_Verif,a body eats a slice of pizza,0,0
I02U_Verif,he is eating the pizza,1,1
I02U_Verif,the boy is eating a delicious-looking pizza,1,1
I02U_Verif,the boy is going to eat a piece of pizza,1,1
I02U_Verif,a boy is going to eat a big pizza,0,0
I02U_Verif,a little boy is eating a piece of pizza,1,1
I02U_Verif,a little boy is eating a pizza,1,1
I02U_Verif,he's having a pizza,1,1
I02U_Verif,the boy is enjoying his pizza,1,1
I02U_Verif,the boy is hungry and eat a piece of pizza,1,1
I02U_Verif,the child is eating a piece of pizza,1,1
I02U_Verif,the boy is eating for pizza,1,1
I02U_Verif,the little boy is eating pizza,1,1
I02U_Verif,the kid is eating a pizza,1,1
I02U_Verif,the boy in green shirts is eating a piece of the delicious pizza,1,1
I02U_Verif,a boy is eating a big slice of pizza,1,1
I02U_Verif,the boy is excited about the pizza he is about to eat,1,1
I02U_Verif,the little boy is going to eat pizza,1,1
I02U_Verif,he loves pizza,1,1
I02U_Verif,he is eating lunch,0,0
I02U_Verif,the boy is about to bite the pizza,1,1
I02U_Verif,the boy is eating food,1,1
I02U_Verif,this boy is getting ready to eat a slice of pizza,1,1
I02U_Verif,the slice of pizza is about to enter the boy's mouth,1,1
I02U_Verif,the boy is about to eat a delicious slice of pizza,1,1
I02U_Verif,"the boy is about to taste a nice, hot pizza",1,1
I02U_Verif,the boy is going to eat some pizza,1,1
I03U_Verif,the lady is receiving a package,1,1
I03U_Verif,the man is handing the lady a package,1,1
I03U_Verif,a delivery person is accepting a package,1,1
I03U_Verif,a woman is accepting a package from a delivery man,1,1
I03U_Verif,the man is delivering a package,1,1
I03U_Verif,the woman is receiving a package,1,1
I03U_Verif,a guy is handing a box to a girl,1,1
I03U_Verif,a girl is holding a box,0,0
I03U_Verif,the receptionist is receiving a package,1,1
I03U_Verif,the delivery man is handing package to the receptionist,1,1
I03U_Verif,the boy gives the package to the girl,1,1
I03U_Verif,the girl receives the package from the guy,1,1
I03U_Verif,"the finance is gifting a box to his wife-to-be on their anniversary, for it is a token of his passion",0,0
I03U_Verif,the woman is the recipient of ta parcel conveyed by the mailman,1,1
I03U_Verif,the woman receives a package,1,1
I03U_Verif,the delivery man has arrived,1,1
I03U_Verif,a woman received a package from the delivery boy,1,1
I03U_Verif,the woman is sending a package with delivery pickup services,1,1
I03U_Verif,a man is delivering a package,1,1
I03U_Verif,a woman is receiving a delivery,1,1
I03U_Verif,the delivery man gives a package to the receptionist,1,1
I03U_Verif,the man is delivering a parcel to the woman,1,1
I03U_Verif,the man is looking over the head of the woman while delivering the package,1,1
I03U_Verif,a woman receives a package,1,1
I03U_Verif,a man delivers a package,1,1
I03U_Verif,a delivery man is handing a package to a lady,1,1
I03U_Verif,a package is being exchanged between two people,1,1
I03U_Verif,two people are exchanging a package,1,1
I03U_Verif,the delivery man is delivering a package,1,1
I03U_Verif,the secretary is accepting a package,1,1
I03U_Verif,the man gives the woman a box,1,1
I03U_Verif,the woman receives a box from the man,1,1
I03U_Verif,the woman at the desk is receiving a package,1,1
I03U_Verif,the delivery man is giving the woman a package,1,1
I03U_Verif,the man is delivering the package to the woman,1,1
I03U_Verif,the woman is receiving a package from the delivery man,1,1
I03U_Verif,a woman accepts a delivery,1,1
I03U_Verif,the delievery man hands the receptionist a package,1,1
I03U_Verif,the delivery man is giving the lady a package,1,1
I03U_Verif,the lady is accepting a package from the delivery man,1,1
I03U_Verif,the secretary is receiving a package from the delivery man,1,1
I03U_Verif,the delivery man is delivering a package to the secretary,1,1
I03U_Verif,the girl is receiving a package,1,1
I03U_Verif,receiving a gift,0,0
I03U_Verif,happy about this,0,0
I03U_Verif,a delivery man is handing a receptionist a package,1,1
I03U_Verif,the woman is accepting a package from a delivery man,1,1
I03U_Verif,a courier is making a delivery,1,1
I03U_Verif,a woman is accepting a delivery,1,1
I03U_Verif,the receptionist is accepting a package from the delivery man,1,1
I03U_Verif,the delivery man is giving the receptionist a package,1,1
I03U_Verif,a delivery man is giving an office worker a package,1,1
I03U_Verif,delivering mail package,0,0
I03U_Verif,to a woman,0,0
I03U_Verif,the woman gets the package from the deliveryman,1,1
I03U_Verif,the delivery man gives the package to the woman,1,1
I03U_Verif,a woman is receiving a package from a delivery man,1,1
I03U_Verif,a man is delivering a package to a woman,1,1
I03U_Verif,man giving a woman a package,1,1
I03U_Verif,a man is delivering a package to a woman at her desk,1,1
I03U_Verif,there is a delivery being made at an office,1,1
I03U_Verif,a man is handing a package to the secretary,1,1
I03U_Verif,a delivery is being made,1,1
I03U_Verif,a man is handing a woman a box,1,1
I03U_Verif,a delivery man is handing a package to an office worker,1,1
I03U_Verif,a woman with an abnormally small waist is receiving a package from a delivery man,1,1
I03U_Verif,a package is being delivered to a receptionist,1,1
I03U_Verif,a receptionist is receiving a delivery package,1,1
I03U_Verif,the man gives a package to the woman,1,1
I03U_Verif,the office has received a delivery,1,1
I03U_Verif,man is delivering package,1,1
I03U_Verif,lady is accepting package delivery,1,1
I03U_Verif,a package is delivered,1,1
I03U_Verif,a delivery man is giving a woman a box,1,1
I03U_Verif,a woman is receiving a box from a delivery man,1,1
I03U_Verif,someone sent a box to the office,1,1
I03U_Verif,a messenger is delivering a package to a receptionist at an office,1,1
I03U_Verif,"a receptionist, behind a desk in an office, is receiving a package delivered by a messenger",1,1
I03U_Verif,this guy gaveling a gifted to a woman,0,0
I03U_Verif,this guy given to a woman,0,0
I03U_Verif,the delivery guy is giving the lady a package,1,1
I03U_Verif,a girl is receiving a package,1,1
I03U_Verif,a boy is delivering a package,1,1
I03U_Verif,the secretary is receiving a package while seated at a desk from a delivery man,1,1
I03U_Verif,the deliveryman is handing a package to a woman behind a desk,1,1
I03U_Verif,the delivery guy drops off a package,1,1
I03U_Verif,the lady receives a package,1,1
I03U_Verif,the postman is giving the mail to an employee,1,1
I03U_Verif,an employee is getting the mail from the postman,1,1
I03U_Verif,the man is handing the woman a package,1,1
I03U_Verif,the woman is receiving a gift from the man,0,0
I03U_Verif,a parcel is being delivered to a receptionist,1,1
I03U_Verif,a delivery person is delivering a parcel,1,1
I03U_Verif,a delivery guy is dropping off a package,1,1
I03U_Verif,the girl is accepting a delivery,1,1
I03U_Verif,she is taking the package,1,1
I03U_Verif,the delivery man hands her the package,1,1
I03U_Verif,the secretary received a package,1,1
I03U_Verif,a package was delivered to the office,1,1
I03U_Verif,the secretary is receiving a package delivery,1,1
I03U_Verif,the delivery service drops off a package to its destination,1,1
I03U_Verif,courier man handing over the package to a woman,1,1
I03U_Verif,woman receiving the package from a delivery guy,1,1
I03U_Verif,the receptionist accepts the delivery,1,1
I03U_Verif,the delivery person hands the box to the woman,1,1
I03U_Verif,giving present,0,0
I03U_Verif,giving nice present,0,0
I03U_Verif,a receptionist is accepting a package from a delivery man,1,1
I03U_Verif,a delivery man is picking up a package to be mailed,1,1
I03U_Verif,package,0,0
I03U_Verif,woman is reciving a package,1,1
I03U_Verif,man is handing over a package to the woman,1,1
I03U_Verif,a delivery man is handing a package to a receptionist,1,1
I03U_Verif,a delivery man is giving a package to a woman at a desk,1,1
I03U_Verif,a man is giving a package,1,1
I03U_Verif,a small package delivery associate is delivering a package,1,1
I03U_Verif,this lady is recieving a package,1,1
I03U_Verif,the receptionist is receiving a package from the delivery man,1,1
I03U_Verif,the office worker gave the courier a package to deliver,1,1
I03U_Verif,the courier is delivering a package to the office worker,1,1
I03U_Verif,a woman is receiving a box from a man,1,1
I03U_Verif,the delivering man is handing a box to a lady,1,1
I03U_Verif,receptionist receiving a package,1,1
I03U_Verif,a woman receiving a package,1,1
I03U_Verif,a man is handing a package to a woman,1,1
I03U_Verif,a woman is getting a package from a man,1,1
I03U_Verif,a delivery man is delivering a package to a receptionist,1,1
I03U_Verif,a woman is getting a package,1,1
I03U_Verif,a courier service is delivering a package to an office employee,1,1
I03U_Verif,a woman is receiving a package,1,1
I03U_Verif,delivery man is picking up a delivery from woman,1,1
I03U_Verif,woman is receiving a package from delivery man,1,1
I03U_Verif,the secretary receiving a package from the mailman,1,1
I03U_Verif,a delivery man gives a woman a package,1,1
I03U_Verif,a woman at a desk has just given a man a package,1,1
I03U_Verif,a man is giving a package to a secretary,1,1
I03U_Verif,the secretary is receiving a package from a man,1,1
I03U_Verif,the man is delivering a package to the woman behind the desk,1,1
I03U_Verif,the man standing is giving the woman at the desk a gift,0,0
I03U_Verif,talk front table,0,0
I03U_Verif,talk nurse,0,0
I03U_Verif,a package is being delivered from 'fedex' to the secretary,0,0
I03U_Verif,the woman is getting package,1,1
I03U_Verif,the postman is giving the packet to the girl,1,1
I03U_Verif,the man is passing a package to a woman,1,1
I03U_Verif,woman is collecting a mail from the delivery boy,1,1
I03U_Verif,the postal man is giving the woman a package,1,1
I03U_Verif,the mailman is giving a mailbox,0,0
I03U_Verif,the deliver man is handing a package to the woman,1,1
I03U_Verif,the delivery man is falling love with the girl while delivering,0,0
I03U_Verif,he is delivering a package for the woman,1,1
I03U_Verif,the man is passing the package to the woman,1,1
I03U_Verif,a mail carrier is delivering a box to a woman,1,1
I03U_Verif,the boy gives the girl a gift for marry proposal,0,0
I03U_Verif,the delivery man is sending the woman her belonging,0,0
I03U_Verif,the girl was received the grift,0,0
I03U_Verif,the man is sending a gift to a girl,0,0
I03U_Verif,the man is giving the woman the package,1,1
I03U_Verif,a postman is handing the post box to a woman,1,1
I03U_Verif,the man is giving a package to the lady,1,1
I03U_Verif,the female clerk is getting a box from a express worker,1,1
I03U_Verif,the postman is handing a package to the young woman who sits behind the reception desk,1,1
I03U_Verif,the woman is receiving the package from the boy,1,1
I03U_Verif,the post man is giving a package to a woman,1,1
I03U_Verif,a man is giving a package to a woman,1,1
I03U_Verif,the man is giving present to the woman,0,0
I03U_Verif,a woman is accepting a gift from a man,0,0
