Source,Response,A1,A2
I03U_Verif,a woman is claiming her package,1,1
I03U_Verif,the boy is returning a book to the center desk,0,0
I03U_Verif,the man is giving a package to the woman,1,1
I03U_Verif,the post man is delivering the box to the woman,1,1
I03U_Verif,the postman is delivering the delivery to the woman,1,1
I03U_Verif,the man is delivering a package to a woman,1,1
I03U_Verif,the mailman is giving the mail to the woman,1,1
I03U_Verif,the girl is receiving a thing from that man,1,1
I03U_Verif,a man with a cap is giving a box to a lady,1,1
I03U_Verif,the mailman is handing a package to a woman,1,1
I03U_Verif,the man is giving a package to a woman,1,1
I03U_Verif,a currier is delivering a package to a office girl,0,0
I03U_Verif,the man is delivering package,1,1
I03U_Verif,a woman just received a mail box from a man,1,1
I03U_Verif,the mail carrier is handing a package to the lady,1,1
I03U_Verif,a boy is delivering a box to the woman,1,1
I03U_Verif,the deliver gives a box to a woman,0,0
I03U_Verif,the man is sending the package to the woman,0,0
I03U_Verif,the post-man is delivering a package to the woman in the front office,1,1
I03U_Verif,a postman is giving a package to a woman,1,1
I03U_Verif,the courier is giving the package to the woman,1,1
I03U_Verif,the man give the girl a baggage,0,0
I03U_Verif,the man is delivering a package to the woman,1,1
I03U_Verif,a man is passing a package to a woman,1,1
I03U_Verif,a postman is sending a package to a woman,0,0
I03U_Verif,the man is handing a box to the woman,1,1
I03U_Verif,the lady is revive package,0,0
I03U_Verif,the girl just got a package from the mailman,1,1
I03U_Verif,the receptionist is receiving a mail box from the delivering man,1,1
I03U_Verif,the man give the woman package,1,1
I03U_Verif,the man is giving a box to the woman,1,1
I03U_Verif,a man is delivering,1,1
I03U_Verif,the man gives the bag to the girl,0,0
I03U_Verif,a mailman is giving a woman package,1,1
I03U_Verif,the clerk is receiving a package,1,1
I03U_Verif,a boy is giving his teacher a gift,0,0
I03U_Verif,the transporter is pass the package to the woman,1,1
I03U_Verif,the postman is delivering a package to a young office lady,1,1
I03U_Verif,the package is being delivered to the receptionist,1,1
I03U_Verif,the receptionist is receiving the package,1,1
I03U_Verif,he is delivering a package to the office,1,1
I03U_Verif,he is giving the box to the office worker,1,1
I03U_Verif,she is getting a package,1,1
I03U_Verif,he is giving her a package,1,1
I03U_Verif,the woman is getting a package,1,1
I03U_Verif,the man delivers a parcel,1,1
I03U_Verif,the man in the hat is giving the lady a package,1,1
I03U_Verif,the lady sitting at the desk is accepting the package from the man,1,1
I03U_Verif,the woman is getting a delivery from the post office,1,1
I03U_Verif,the man is delivering a package to the woman at her office,1,1
I03U_Verif,the man could be picking up a package from the woman at her office,0,0
I03U_Verif,the man is giving the woman a package,1,1
