I08,I08 Gramm
the waiter is holding a dish,
the waiter is handing the food,
he is passing the chicken to the customer,
the waiter is serving,
the waiter is serving a chicken to a woman,
the waiter is offering the woman a turkey leg,
he is take a turkey to a women,
the waiter is holding a chicken and giving it to the woman,
the waiter is introduce a roast turkey for the woman,
the waiter is serving for the lady and holding the meal for the lady,
the waiter is giving the woman the thanksgiving special dinner,
he is passing the turkey,
the waiter is putting the turkey on the table,
the waiter is passing a roasted chicken to the female customer,
a woman is waiting to eat turkey,
the waiter is carrying a chicken to the customer,
the waiter is taking a roast chicken,
the waiter is passing a turkey to the woman,
the waiter is serving food to a woman,
the waiter is serving the turkey,
the waiter is bringing the food to the lady,
the waiter is serving a woman,
this handsome waiter who dress formal is serving a yummy chicken to a young lady,
the waiter is serving a dish to the lady,
the waiter is offer a cooking chicken to a women,
the waiter is handling a dish to customer,
the waiter is serving dishes,
the waiter is serving a chicken,
he is putting a chicken on the table,
the waiter is serving a turkey to the lady,
the waiter is showing his ability to the lady,
the waiter is gently serving the young lady with a well cooked turkey in a restaurant,
the waiter is serving chicken to a lady,
the waiter is serving a dish,
he advise the female to try the turkey,
he is serving food,
the waiter is holding a plate of chicken for the customer,
he is giving a turkey to the woman,
the waiter is delivering a chicken,
the waiter is serving for a woman,
the waiter is serving a roasted chicken to the lady,
the woman is waiting to be served her meal,
the waiter is bringing a dish,
the waiter is bring the food to the woman,
the waiter is carrying a chicken for the lady,
the waiter is serving chicken to the woman,
the waiter is giving the meal to his clients,
the woman is waiting for the tasty duck,
he is giving the chicken for a lady,
the waiter is bring turkey to the customer,
the waiter is serving the food,
the waiter is bring the chicken to the women,
the waiter is serving the woman with the turkey,
the waiter is serving the lady,
the waiter is serving a young lady with turkey,
he is holding a food,
the waiter is carrying on a plate of turkey,
sending chicken to the lady,
the waiter bring a hot dish to a female guest,
the waiter is passing a dish to the customer,
waiter holds the plate which have turkey on it,
he is servicing for the woman,
the waiter is serving food for a young lady,
the waiter is giving a dish of turkey,
the waiter is delivering the food,
the waiter is bringing a chicken to a woman,
the waiter is offering the turkey for the woman,
the waiter is giving the woman her dish,
he is putting the turkey which ordered by the woman on the table,
a lady is about to have a turkey for her dinner in a fancy restaurant,
the waiter is taking dish to the woman,
a waiter is serving a woman with a grilled turkey,
"the lady finally get her order, the delicious chicken past by the gentleman",
a cook man is giving food to a woman,
the waiter is serving the woman a chicken,
the waiter offers a dish of chicken to the women who sits on the chair,
a waiter is giving a woman chicken,
this sir gives a turkey to this lady,
a woman is eating in a restaurant,
the waiter is giving the woman a chicken which is cooked well in a restaurant,
the waitress take turkey to the woman,
a female is being served with a rather luxurious dinner by a mexican waiter,
the lady's having a meal at a luxury restaurant,
a woman is enjoying her dinner,
the woman will eat a delicious turkey,
the waiter is send a roasted turkey to a costume,
a waiter is serving a woman with a turkey,
the woman is going to enjoy the delicious turkey,
the waiter is offering the lady chicken,
a gental is taking a turkey to a lady,
the waiter is serving the dishes,
a waiter is taking a turkey to a woman,
the waiter is serving a freshly-cooked turkey to the woman,
the waiter is giving the food to the woman,
the waiter gives turkey to a lady,
a waiter is giving a turkey to a woman,
a waiter is servicing his customer,
a man gives a chicken to a guest,
the food is ready,
a waiter gave the women chicken,
the woman is celebrating thanksgiving with the waiter,
a waiter is handing a chicken to a lady,
the waiter is serving chicken to the customer,
the waitress bring the turkey to the woman,
a waiter is holding a delicious food to a lady who sits by a desk,
the waiter is giving chicken to this lady,
"the waitress is giving a roasted chicken to the woman, which she ordered in the first place",
the woman is going to eat her meal,
the waiter is serving the meal to the woman,
the waitress is serving the food,
the woman is having food,
the servant is serving the woman a turkey,
the waiter is presenting a plate of meat to the woman,
the waiter is serving a chicken to a lady,
a waiter is serving food,
the waiter is going to give the food to that woman,
a lady is eating in a good restaurant,
the woman is waiting for her turkey,
the man is delivering the dish of chicken and the woman is sitting and waiting,
the waiter is serving a delicious turkey to the woman,
a waiter is severing a lady in a restaurant,
the server is handing a turkey to the guest,
a waitress is serving turkey to a elegant woman in a fancy restaurant,
the woman is having a dinner,
a man is serving a lady,
the woman is drinking the tea,
the waiter is providing a meal for the woman,
the turkey is extremely good,
a waiter is serving the main dish for the customer,
the man is serving the woman for her turkey,
he is offering chicken for the client,
the waiter is serving food,
the woman is served with a plate of chicken,
the server is serving a dish to a woman,
the waiter is serving the woman a roasted chicken,
the woman is being served dinner by the waitor,
the waiter is passing the turkey to a customer,
the waiter is bringing the food the the customer,
the waiter is bringing a customer a hot turkey,
he is serving dinner,
the waiter is bringing out a meal,
the waiter is carrying food to the table,
the waiter is serving the woman,
the waiter is serving the woman an entire turkey,
he is serving her diner,
he is serving a chicken,
the waiter is serving an entire roast turkey to a woman sitting alone at a table,
the waiter appears to be taking great pride in presenting an entire roast turkey to a woman sitting alone at a table,
the waiter is carrying a turkey,
the waiter is serving a turkey,
the waiter is serving the woman her food,
he is bringing the woman her dinner,
the waiter is serving dinner,
the waiter is delivering chicken,
the waiter is serving the customer,
the waiter is delivering a chicken to the woman,
he is serving the woman a meal,
the waiter is serving the woman turkey,
the waiter is giving the customer her warm meal,
the waiter is presenting the food,
he is about to serve the dish,
the waiter is serving the lady an entire turkey,
"as the waiter serves the woman a whole chicken, he wonders if she will attempt to eat it all in one sitting",
he's serving the meal,
he's serving dinner,
the waiter appears to be presenting a large cooked bird to a solitary diner,
the waiter appears to be standing holding a a serving platter containing a large cooked bird,
the waiter is presenting a meal to a customer,
the waiter is servicing an order,
placing the turkey on the table,
asking the patron if it is cooked to her taste,
the waiter is presenting an enormous amount of food for the single woman,
the waiter is serving her order,
the waiter is bringing a turkey,
the waiter is holding a tray,
the waiter is showing the lady a roasted bird,
food,
eat,
he's serving an entire turkey to the lady,
he's getting ready to carve the turkey,
he is delivering and serving food to the customer,
the waiter is serving food to the lady,
a platter of turkey is being served by the waiter,
delivering food,
a turkeyr,
the waiter is serving the woman food,
he is serving the diner,
undressing the woman with his beady eyes,
undressing the woman with his beady eyes more,
he's serving a roast chicken,
he's serving the lady,
the server is serving a chicken dinner,
the waiter is delivering a fowl to the lady,
the lady is receiving her order of a fowl,
the waiter is delivering the woman food,
the waiter is delivering the woman with a giant turkey,
the waiter is serving his customer,
he's bringing his customer her food,
showing the customer how the turkey will look at the party she is throwing,
is this how you would like the turkey served,
this waiter is serving a lone diner a huge amount of food,
this waiter is showing his customer a sample of the chicken,
he's brought her dinner,
the waiter is serving a whole turkey to the woman,
the waiter is seeking the woman's opinion on how the turkey looks,
the waiter is serving a meal,
he is serving a meal,
serving a customer,
bringing out a meal,
the waiter is bringing the woman an entire turkey?,
the waiter is bringing his customer her meal,
the waiter is serving the woman's turkey,
the waiter is standing,
serving food,
serving hot food,
the waiter shows the entr_e to the woman,
he displays a turkey entr_e for the lady,
this waiter is delivering a hot piece of meat,
the lady is ready to accept a hot piece of meat,
"the waiter making sure he delivers,the correct meal",
serving food to the lady,
proudly serving food to the lady,
the waiter is expecting the woman to speak,
the man is serving the woman her food,
the server is giving the customer her meal,
he is serving food to the woman,
the waiter is serving her a turkey,
the waiter is serving the customer food,
the waiter is serving a turkey to the woman,
he is serving the customer her meal,
t.he waiter is showing the woman a roasted turkey,
the waiter is serving the woman a roasted turkey,
the waiter is bringing the food,
the waiter is serving the lady her food,
serving the patron,
bringing the food to the table,
walking by the table with food,
bringing food to the table,
bringing chicken to the table,
the waiter is serving a turkey dinner to a lady that will need a doggie bag to take most of it home,
the waiter is working,
i think the young lady likes the smell of a roasted turkey,
"he said, what do you think of this roasted turkey?",
the waiter is trying hard not to tip the hot bid into the lovely lady's lap b ecuase his fingers are burning from a hot platter,
the waiter is doing a fine job balancing the hot bird on a very hot platter,
serving a patron,
this is one of the stupidest surveys i have ever taken; u people r nuts,
the waiter is serving a turkey dinner,
the waiter is delivering food to a table,
"waiter presenting the main course before carving, for her approval",
"the waiter is showing the potential diner how wonderful the turkey he has prepared is, in the hope she will order it for her meal",
the waiter is serving the woman her order,
the waiter is showing the woman a sample of the restaurant's evening special,
serving dinner,
a waiter is serving a roasted bird,
a woman is being served a roasted bird by a waiter,
he is serving chicken to a woman,
the waiter is bringing the meal,
the waiter is delivering the meal,
fjjg,
krkfo,
the waiter is bringing food to the woman,
the waiter is showing the food to the woman,
he is bringing her food,
the waiter is serving a customer,
the waiter is showing the lady the bird he will be serving,
the waiter is giving the lady a whole chicken,
the woman is being served turkey at a restaurant,
the waiter is server the woman dinner,
the woman is receiving a plate of chicken,
the man is presenting a beautifully cooked turkey for the woman's inspection,
the woman is checking to see if the man cooked the turkey correctly,
the woman is having dinner,
the waiter is serving the woman a turkey,
the waiter is bringing the lady a cooked turkey,
"the lady is sitting at the table with her coffee, ready to eat her cooked turkey",
that woman is about to eat a whole bird,
the waiter delivers food to the customer,
she has been stood up,
the turkey looks delicious,
the waiter presented the roasted bird,
the waiter brought the woman her dinner,
the waiter is delivering food,
the lady is viewing the food that has been delivered by the waiter,
she is having dinner alone in a fancy restaurant,
the wait-person is asking her if the roasted chicken meets her approval. and if she is ready for the meal or continue to wait,
the woman is sitting down to a turkey dinner,
the waiter is serving turkey to the lady,
a waiter shows his manager a cooked turkey to prove his arm strength,
a woman wonders why a waiter is bringer her a cooked turkey when she is drinking her morning coffee,
the husband have fix a chicken dinner for two to him and his wife,
the lady have order roasted chicken for two,
woman is eating alone,
waiter is bringing chicken,
a waiter is serving dinner to a patron,
a woman is having dinner in a restaurant,
a woman is being served dinner,
a waiter is serving dinner,
a woman is being served in a restaurant,
a man is serving a turkey dinner,
a woman has ordered a turkey dinner,
a women at a restaurant,
a woman receiving her meal at a restaurant,
the lady ordered a turkey dinner,
the waiter has delivered a turkey dinner to the lady,
the woman's husband is role playing as a server for date night,
the waiter is providing the woman with a preview of the daily special,
the waiter is bringing a roasted turkey to the woman,
the waiter is serving a roast turkey to a woman in the restaurant,
this woman is about to eat a huge dinner all by herself,
this lady ordered a whole turkey for herself,
a waiter serving food,
a customer being served food,
a waiter is bringing a turkey to a table,
a server is bringing a meal to a restaurant table,
the waiter is serving the diner a turkey or chicken,
"the woman is eating at a fancy restaurant alone, how sad",
eating,
eating dinner,
"a server brings an entire turkey to the woman's table,",
the waiter asks the woman if this turkey is acceptable,
chef fix chicken to the lady,
lady's chicken order arrived,
the woman is being served an entire turkey with no plate or silverware,
the horrible waiter forgot to set the table,
dinner is served,
she is having chicken for dinner,
she is about to eat dinner,
the waiter has brought a freshly cooked chicken to the table for her to eat,
a waiter is serving a turkey,
"she,s thinking, ""there goes my diet!""",
a waiter is serving a whole turkey,
a young woman is about to be served,
the woman is being served dinner,
a women is eating in a restaurant,
the waiter serves a chicken to the women,
the waiter brings a steaming hot turkey to his client,
a female customer is waiting for her hot turkey dinner,
a woman is receiving her meal,
the lady is being served a turkey,
the turkey is steaming,
a waiter is serving turkey to a customer,
a customer is being served dinner by a waiter,
the waiter has brought the woman a turkey,
the woman only drinks coffee and eats whole turkeys,
a waiter is serving a chicken/turkey to a female customer,
a woman is being served a turkey/chicken at a table,
the waiter serves a meal,
a woman eats alone,
waiter delivering dinner to a guest,
guest waiting for dinner,
the woman receives her dinner,
someone has ordered a very basic thanksgiving dinner,
a waiter is delivering food to a table,
a woman is receiving a plate of food from a waiter,
a waiter is serving a whole roasted turkey to a woman,
a waiter holding a roast turkey is standing before a seated female customer,
a turkey is being served,
a woman is receiving her food from the waiter,
woman is eating a turkey dinner all alone,
waiter is serving a whole turkey,
a waiter delivers a woman her meal,
a woman patiently receives her meal,
i wallman out eating,
are you guys serving a woman dinner,
the woman is being served by the waiter,
eating alone,
turkey,
a waiter is serving a woman dinner,
the waiter is bringing the woman a chicken,
the woman is being brought her chicken by the waiter,
a waiter is bringing food at a table,
a woman is accepting food from a waiter at her table,
the waiter presents the diner with her main dish,
the hot food is delivered to the woman by the waiter,
waiter serving turkey,
looking forward to eating this and enjoying the feelingt,
the woman is about to eat turkey,
the waiter is getting ready to passive aggressively drop a turkey in that woman's lap because she is a horrible rude customer with a sense of self entitlement that is specific to the generation y people,
the lady is eating for one at her favorite restaurant,
the lady ordered chicken for dinner,
the waiter is bringing the lady her turkey,
the lady is happily waiting to eat the turkey,
the server brings the woman her food,
the woman is being served a cooked chicken by a waiter,
a waiter is delivering the woman's food to her table,
the waiter is serving the woman her dinner,
the woman is receiving her dinner she ordered,
the woman receives a cooked turkey from a waiter,
the waiter gives the woman a cooked turkey,
the man is serving the lady a delicious meal,
the lady is being a served a turkey,
a waiter is delivering food to a patron,
a patron is receiving a food order from a waiter,
a very hungry woman is receiving her meal,
a waiter is delivering roasted chicken to a woman diner,
a man serves food to a woman,
"the woman regrets ordering an entire roast turkey which, she realizes, belatedly, is a waste of food",
the waiter is delivering a roasted turkey to the lady at the table,
"the lady must be expecting someone to join her for a meal, which likely will include other food items; perhaps dressing, potatoes, cranberry sauce, various vegetables and gravy",
her order is being delivered to the table,
she receives her food from the waiter,
a woman is about to eat a whole freaking turkey,
the woman has ordered animal flesh,
this woman is not vegan,
the waiter serves dinner to the woman,
the whole turkey is served to a young woman,
the waiter brings the food,
the food is brought by the waiter,
"""your dinner is served, madam.""",
the lady likes hot liquids with her turkey,
a chef is serving,
a girl is sitting,
the waiter serves dinner,
this lady likes chicken,
a waiter presents food to a woman,
a woman examines food presented by a waiter,
