I09U,I09U Core
a girl is riding on a horse,
a girl is riding a horse,
a women is learning how to ride a horse,
the girl is riding the horse,
a lady is riding on a horse,
the girl is riding a horse,
a girl is riding,
a girl is on a horse,
th girl is riding a horse,
the girl is riding the animal,
the girl's riding a horse,
a girl is riding hours,
the girl is riding the horse on the grass,
the lady is riding the horse,
a girl is taking a hose happily,
the girl is ride a horse,
the girl is riding a beautiful horse,
she is riding,
the girl is riding a house,
a girl who wear a pink clothes is riding a horse,
a girl is riding horse,
the girl is riding a horse on a saddle,
a young is riding a house,
a lovely girl ride on horse,
the little girl is riding a horse,
the woman is riding the horse,
the girl is riding on the horse,
a gril is riding a horse,
the girl is ridding a horse,
the girl is riding a brown horse in the green grass,
a girl is riding a house,
a determined girl is riding a brown horse,
the girl is ridding the horse,
the girl is ridding house,
the girl is unhappy,
a woman rider is practicing her skills,
she is riding the horse,
the girl is learning riding horse,
the woman is horseback riding,
the woman is riding a horse,
the girl is riding horse,
the girl is going for a ride on her horse,
the horse is being ridden by a girl,
"the happening is a horse show. (you have a typo in this question, perhaps.)",
the girl is riding a pony,
the girl is going for a ride on a horse,
the horse is carrying a girl,
the girl rides a horse,
the horse is trotting the girl around on the grass,
she is riding a horse,
the horse is trotting,
the equestrienne rode contentedly,
she is dressed & ready for the fox hunt,
she is practicing for the running of the hounds in a fox hunt,
a girl is riding a brown horse,
a young woman practices equine therapy as an experimental treatment to reduce the size of her gigantic head,
a fearful horse braces for a girl's rage,
the little girl have gone horseback riding on a good day,
the little girl is competing in a horse show,
girl is horseback riding,
girl is riding horse,
a girl is in an equestrian event,
a horse is being riden,
a girl is riding her horse,
a girl is taking horseback riding lessons,
a horse is being ridden by a girl,
a girl riding a horse,
horse riding lessons,
a girl is taking her horse through the pasture,
the horse is trotting along,
the girl is enjoying a stroll with her horse,
the girl on the horse is taking riding lessons,
a little jocky is riding a horse,
a little jocky girl is riding this horse,
a horse being ridden by a girl,
a girl in a pink coat and black helmet is riding a horse,
the horse is concerned about the girl riding it,
horse,
riding horse,
edie loves to ride her horse,
the girl and her horse are out for a ride,
girl rode the horse,
horse ride by a girl,
a girl rides a horse,
the horse is unsure of it's enthusiastic rider,
she is happy riding her horse,
the girl is riding her horse,
she is taking her horse out for a ride to get ready for the competition,
the girl seems mad at the horse,
the horse looks apprehensive,
a young girl is riding a horse,
a horse is being ridden by a happy young girl,
the horse is being ridden by the girl,
the horse is being rod by the girl,
a small girl is riding a horse,
"while riding her horse in a meadow, the girl does not notice the miscievious look in the eye of her horse",
a horse is being risen,
the horse is looking at the girl,
a horse is being ridden by a youngster,
the girl is in a horse riding competition,
the horse is trotting around the field,
a woman rider is trotting on her brown horse,
this brown horse is being ridden by a woman,
the girl rides her horse,
she practices riding,
girl riding her horse,
horse being ridden by a girl,
the woman is an equestrian,
a girl is riding horseback,
a horse is giving a girl a ride on horseback,
a girl with a weirdly large head is riding a horse,
a girl wearing equestrian attire is riding a brown horse which is looking askance,
a girl sits upon a galloping horse,
confident girl is riding a horse,
she is taking riding lesson,
a girl determinedly rides a horse in full jockey getup,
a horse endures captivity and complies to a little girl's demands with resignation,
hey girl riding a pony,
hey girl riding horse,
the little girl is riding a brown pony,
little girl,
riding a horse,
a horse is giving a girl a ride,
a brown horse is being ridden by a young girl,
the young equestrian girl rides her horse,
the brown horse gallops with the equestrian,
young lady riding her horse,
she is enjoying the moment!~ the horse is not sure,
the girl is running away from an abusive home on a stolen horse,
the little girl is taking riding lessons,
the little girl is trotting along on her horse,
the girl is going for a horseback ride,
the horse is taking the girl for a ride,
an equestrian rides a horse,
the horse is trotting with a girl on its back,
the girl is taking a horse ride,
the horse is carting the girl,
the girls is riding the horse,
a future equestrian is learning the art,
riding her horse is a joy to the young girl,
the girl takes a horse for a ride,
the horse takes a girl for a ride,
the girl rides a pony,
"the girl rides using good posture, but the reigns are too slack",
a horse is looking nervously at his rider,
the child is riding a horse,
the girl rides the horse,
the horse questions the girl's motives,
the horse is ridden by the girl,
the young lady is horseback riding,
the young lady is training for a tournament jumping horses,
a girls on a horse,
a horse is running,
the girl is dressed for equestrian events,
a young girl rides a horse,
a horse carries a young girl,
