I11T,I11T Core
the boy is asking a question to the man,
the boy is questioning,
he is asking the question,
the boy is asking,
the boy is asking questions,
the boy is questioning to an adult,
he is asking a question to his father,
the boy is asking his teacher a question,
the little is asking a question,
the boy is asking question to his father,
the boy is asking his father that why they have different color of hair,
he is asking a question,
the boy is asking question to another young men,
a little boy is asking questions,
the boy asks a question to his father,
the boy is asking a question,
the boy is asking questions to the man,
the boy is asking the questions,
the boy is confusing,
this young boy presents a question that confused him for so long to his father,
the boy is asking question,
the boy is asking some questions toward the young man,
the boy is asking the man a question,
the boy is asking the man questions,
he is asking question,
the boy is talking with other man,
the boy is asking the guy questions,
the boy is talking to the man,
the boy is asking the questions to the teacher,
the boy is asking his teacher some question,
the boy is asking questions to that man who stand nearby,
the boy is asking for the answers of his problems from his father,
the boy is asking for a problem to his father,
the boy is questioning the man,
he is asking his teacher problems,
asking a man for questions,
the boy is asking question to his dad,
the boy is asking the questions to his father,
the boy is asking to a man,
the boy is asking questions to a adult,
the boy is asking questions to the older person,
the brother is listening to his younger brother's question maybe he will answer it for him,
the boy is asking his teacher questions,
he is asking questions to his father,
the boy is asking a man question,
the boy is requesting a response,
he is asking his dad a question,
"the boy is asking an older male, perhaps his father or brother, a question",
"the boy appears to be asking a more grownup young man, perhaps his brother or father, a question about something, as young children often do",
the boy is posing a question,
the boy is asking his dad a question,
he is asking a man a question,
the boy is looking for answers,
the boy is asking his father a question,
the boy is questioning the question mark above his head,
the boy is asking the adult a question,
the boy is expressing confusion to the man,
the curious boy is wondering about existence,
the boy has a question he is asking,
the boy is asking directions,
the boy is asking his father an existential question,
he is asking the man where babies come from,
he's asking a question,
he's asking his dad for something,
the boy appears to be asking a question of the older male person,
"since the right index finger is pointing upwards, he may be asking the older male person, ""why is the sky blue?"" or he may be pointing to a burnt-out light bulb and asking why it hasn't been replaced",
the boy is asking an adult a question,
asking the man a question,
wondering why he has to do something,
the boy is stating his case for higher allowance,
the boy is talking with his dad,
the boy is asking for permission,
ask,
talk,
the boy is trying to have a conversation with a little boy,
the little boy is asking the older boy a question,
asking a ?,
to hi dad,
he is asking the man something,
asking his father about his crappy genetics,
lying to an adult,
he's asking for an explanation,
the dad is happy because his son is asking him a question,
the child is trying to ask his father a question,
the child is curious about something and the father is trying to help him understand,
the boy is wondering something,
the boy is questioning something he's been told,
why he cant stay up later,
why cant we go out to dinner,
this boy is questioning his father,
this young man has multiple questions for his parent,
he's snitching,
he has nominterest in the boy,
the boy is asking his father for some advice,
the boy is telling his dad a riddle,
asking a question,
wanting information,
the boy is asking his father something,
the boy is speaking,
asking his dad a question,
he wants to understand,
the boy's intelligence is rising,
the boy is answering a question,
the boy is a little nervous,
the boy has an idea,
the boy is questioning his father,
the kid is asking a question,
the boy is asking for help,
he is uncertain about something and wants to see if the man can clear up his confusion,
the boy is curious,
the boy is telling his father about a problem,
"the boy is upset about something and his telling his father about it, dad is listening",
omg,
answering a question,
making a statement,
he is confused,
the boy is asking his dad for money,
the boy is demanding money from his dad,
i think the boy is asking a question,
perhaps the boy is telling a lie,
the boy is trying to convince his big brother to take him somewhere,
the boy is explaining quantum physics to his classmate,
this boy is confused,
this boy is asking a question,
the young boy is asking a question,
this boy is engaging in conversation with an adult,
the boy's asking asking a question to the man,
the boy is making a query,
he is wondering about something,
the boy wants to know the answer to his question,
hrufkfjf,
nfjf,
the boy does not understand so he is asking a question,
he is talking to the man,
the boy is questioning the mans reasoning?,
the boy has a question,
