I22,I22 Nativ
the woman is reporting the weather condition,
the woman is broadcasting the weather,
she is hosting the weather forecast,
the woman is forecasting the weather,
the woman is introduce the weather,
a woman is forecasting weather,
the weather reporter is telling us that tomorrow is cloudy,
she is report the weather,
the women is reporting the weather,
the woman is introduce the weather in different region,
the woman is talking about the weather,
the weather program host is saying that it is cloudy in the bloomington tomorrow,
a weather reporter is reporting the weather news,
the broadcaster is talking about the weather,
the woman is making a climate prediction,
a woman is broadcasting weather to audience,
the news reporter is reporting the weather,
the woman is broadcasting the weather report,
the woman is telling us the weather,
the woman is reporting the weather,
a women is reporting wether forecast,
a woman is introducing and explaining weather condition,
the interviewer is presenting the weather for tomorrow in television,
the weather reporter is reporting weather,
the woman is talking about the wether,
the woman is showing the weather of tomorrow,
the weather reporter shows that the weather is going to be cloudy,
the woman is reporting on weather,
a woman is talking about climate tomorrow,
the lady is shooting a video about the weather tomorrow,
she is introducing the weather,
a woman is introducing weather conditions,
the woman is reporting weather,
she is teaching in a elementary school,
the woman is telling the weather forecast,
the woman is predicting the weather,
a woman is reporting about the weather,
a women on tv is showing the weather,
the woman is boarding weather,
the lady is introducing the weather to people,
a woman is reporting the weather,
a weather forecaster is forecasting the weather,
the woman is saying the weather prediction,
the lady is broadcasting the weather,
the woman is showing the weather about different areas,
the board caster is reporting future weather condition,
the woman is introducing the weather broadcast,
she is talking about the weather,
the woman is showing the weather,
the woman is introducing the weather,
the woman is a weather reporter,
a weather reporter is introducing the climate change,
a host is describing the weather,
the broadcaster is introducing the weather,
the woman is telling about the weather,
a woman is touching the screen and tell the situation of weather in different areas,
the woman is illustrating the weather situation,
this lady is introducing the weather on tomorrow in this area,
the woman is predict the climate on tomorrow,
the woman is presenting the weather forecast,
the woman is talking about the weather forecast,
a woman is predicting the weather,
a woman is talking about the weather,
the speaker is talking about the weather of her country on the tv,
the woman is telling people what the weather and climate of an area are,
she is reporting the weather,
the woman is reporting the weather in the tv channel,
the woman is explaining how the weather looks like,
the woman is analyzing the weather,
the woman is making a weather report,
she is standing to broadcast the weather,
the woman is hosting a tv show,
the woman is hosting the program,
the woman reports today's weather,
the woman is broadcasting the weather condition,
she's forecasting the weather,
a woman is telling us the weather,
a woman is doing a weather reporting,
the woman is explaining the weather of prediction,
the women points out that country will have cloud,
she is describing a local weather,
she is introducing the wether,
a weather host is reporting today's weather,
the woman is talking about the weather on the screen,
a woman is board casting weather,
the woman is shooting a program,
a host is showing the weather forecast,
the woman is broadcasting weather,
the woman is reporting the weather in tomorrow,
a lady with red hair talks about the weather in difference areas have,
the woman is showing the weather in that place on the map,
the woman is showing forecast for the weather,
the woman is reporting the wether,
the woman is broadcasting,
the woman is doing a weather reporting,
the woman is presenting the broadcasting,
she is showing the weather condition to others,
she is forecasting the weather,
she is introducing weather,
she is telling the weather in the future,
the woman is talking about whether in different area,
the woman is having a weather reporting,
the young beautiful woman is broadcasting wether forecast,
the woman is casting the weather report,
the woman is reporting climates,
the woman is weather forecast,
a hostess is doing weather prediction,
the woman is talking,
the woman is pointing at a weather board cast table,
the woman is reporting the weather forecast,
reporting weather,
she is broadcasting the weather,
the woman is forecasting,
she is discussing about weather,
the woman is board-casting news about weather,
the woman is telling how's the weather,
a woman is forecasting the weather on tv,
a meteorologist is predicting the weather,
a meteorologist provides a weather forecast,
the weather forecast is presented by a woman,
today's weather forecast is shown by a lady,
the woman is showing the weather forecast,
the woman is showing there is cloudy weather and rain ahead in the forecast,
she is delivering the weather report,
she is explaining the weather,
a female meteorologist is presenting a weather report,
a weather report is being presented by a female weather reporter,
the woman is presenting the weather,
the woman is discussing the weather forecast,
the woman is giving the weather report,
she is pointing to a weather map,
the woman thinks it might rain,
the woman is pointing on the map,
the woman is telling someone the weather,
the meteorologist is reporting the weather,
the woman is showing the weather on a map,
she is giving the weather forecast,
the meteorologist is predicting partly sunny weather today,
the weather lady is doing the forecast,
"a woman is pointing at the map, talking about the weather",
the lady is explaining the weather,
the woman is displaying a map,
the lady is describing the weather,
the weather report is happening,
a meteorologist is giving the weather report,
the weather lady is on the tv,
the weather lady is telling us about the weather,
the meteorologist explains the weather forecast,
the woman is pointing to a partially covered sun,
the woman is standing in front of a weather map,
the woman is giving the weather forecast,
the weather lady is showing the forecast,
the weather is partly cloudy today,
there is a woman pointing to a weather map,
there is a woman with a brown dress next to a map,
it is sunny outside,
a woman is explaining a weather map,
a woman is predicting the weather using a map,
a woman is informing people of the predicted weather patterns,
the weather lady does her job,
woman is showing the weather,
woman is telling us about the weather,
she is explaing the weather condition in that region,
it is going to be mostly sunny during the day with occassional c;oud formation,
a woman is reviewing the weather map,
a woman is pointing out the weather in a particular area,
the meteorologist is showing us the weather,
the lady is pointing to a map with clouds,
a meteorologist is giving a weather prediction,
a meteorologist is forecasting the weather,
the meteorologist is giving the forecast,
the weather forecast is being given,
a weather girl is reporting the weather,
the weather person is telling us what the weather will be,
the weather women is explaining the weather patterns for the near furture,
the weather lady says that it will be sunny and then cloudy,
"the day will begin as a sunny one, but, later, it will cloud over says the weather lady",
the weather is being reported by a woman,
the weather woman is discribing he weather patterns which the believes with bring rain,
"the yound weather woman knows that she is perdicting a weather pattern which likely will not develop,",
the weather is being reported by the woman,
a woman is doing the weather report,
the meteorologist is showing what the weather is in new mexico,
the lady is showing what the weather forecast is across the u.s,
a weather reporter explains a map,
the female reporter shows movement of the weather in a certain area,
sally is trying to point to iraq on a map,
robot shuts down during middle of weather forecast,
the woman is pointing to a place on the weather map,
the lady is a weather forecaster,
the lady weather forecaster is indicating that rain may be on the way,
a person has a hand on its stomach and a hand on a map,
it is raining somewhere,
she is reporting the weather for all to see,
a young woman is telling us about the weather forecast,
the woman is pointing to a weather map,
the weather map is being explained by the woman,
the lady is reporting on the weather,
the weather person is giving us the weather report,
the weatherlady is showing the weather on tv,
the lady is pointing to the incoming weather on the map,
the lady is reporting the weather,
the lady is giving a weather forcast,
the woman is giving a weather forecast,
the meteorologist is pointing to the map,
the weatherwoman is predicting rain,
a person is presenting a weather forecast,
a weather forecast is being presented,
??,
a woman is working at her occupation,
the lady is trying to tell us about the weather forecast,
she is pointing her fingers on the weather forecast,
meteorologist delivers forecast,
"unable to open her mouth, the channel 33 weather girl tries it with sign language",
the weather report shows part clouds and sun today,
the eather report shows possible rain showers today,
weather lady is giving a forecast,
news anchor predicting the weather,
the weather person is pointing to a weather map,
"wxyz weather person, anita is showing her audience that the weather for the day is partly cloudy",
a woman reports the weather,
the weather woman reports sun,
h,
u,
the meteorologist is delivering the weather report,
the woman is pointing out the weather for a given area,
a meteorologist is describing the weather,
a television meteorologist is providing a weather forecast,
woman is giving a description of the weather,
woman uses a map to show the weather,
weather,
female meteorologist,
hahahah,
hahaha,
young woman visualizing the bloated feeling she has after a large mexican meal,
flatulence explained by a victim of the disgusting disorder,
the weather is supposed to be partly cloudy,
this woman is reporting the weather,
the meteorologist is on tv,
men are masturbating to the hot woman,
the woman is telling the weather,
the meteorologist points out the weather,
the weather girl says it's cloudy,
the woman is giving the weather prediction,
she is predicting a partly cloudy day,
the woman is describing the weather,
she is showing the weather forecast,
the lady is telling us about the weather,
the woman is giving the weather,
the woman is pointing at the map,
the woman is standing next to a map,
she is showing the weather map,
she is demonstrating a weather pattern,
she is giving the weather report on television,
the woman is announcing the weather,
the woman is being a weather man,
the woman is projecting the future weather forecast,
the woman is showing that the weather will be partly cloudy over the southern region,
the woman is explaining that it will be sunny for part of the day,
the woman is giving a weather report,
the woman is showing that it is cloudy,
describing the weather,
describing where the bomb will land,
reporting the weather,
give my directions,
teaching,
the woman is a meteorologist,
the woman is presenting a weather map,
the woman is showing a map of weather conditions,
standing,
pointing out things on the map,
giving a weather report,
she is doing her job,
she is a weather forecaster,
she is giving the weather report,
showing the weather report on a map,
she is pointing at the map,
the woman is demonstrating the area of weather activity,
the newscaster is telling the weather report,
the woman is a weather reporter and is telling us the weather for today,
woman is giving a weather forecast,
woman is predicting cloudy weather,
the women is giving the weather report on tv,
the weather women is giving the weather forecast,
the woman is showing the forecast,
pointing at the pictures,
sanding,
a woman is pointing to a weather map,
the weather lady is pointing to the weather map,
weather hottie rubs map,
weather broadcaster,
reporting the weather in tv or live broadcast,
the newswoman is talking about the weather,
she is on tv,
the weather report shows clouds,
the reporter shows the forecast for today,
giving the weather report,
talking about the up coming weather,
read map,
talking,
this woman is a weather forecaster,
this woman is trying to predict the weather,
the woman is giving a weather forcast,
she is pointing to a map,
forecasting the weather,
reading a map,
she is broadcasting the weather wishing she was that smokin hot mexican weather girl with the phat ass,
as,
asd,
she is giving a demonstration,
she is drying her nails,
she is telling us that it will be partly sunny in the middle of australia,
the woman is explained the up coming weather,
the woman is pointing to a map,
the woman is telling an audience the weather forecast,
the lady is a meteorologist and is forecasting the weather on the daily news,
today's weather is partly cloudy with a small chance of showers,
the woman is doing a weather forecast,
the woman is doing a weather forecast on tv,
showing the weather forecast,
telling the weather,
the woman is pointing at a map,
she is giving a tv weather report,
she is working in front of a green screen,
the woman is pointing,
the weather person is showing what the weather is like,
today's forecast is partly sunny,
the woman is showing a weather forecast,
she's working,
she is putting a hand on a map,
"she is pretending to be a weather forecaster, or maybe a teacher",
the woman is using the map,
the woman is explaining the weather,
she is talking about a map,
the woman is describing the forecast,
she is in the middle of presentation,
she points out something on the graph,
the woman is working as a weather announcer at a tv station,
giving a geography lesson,
playing charades,
the woman indicates the weather forecast,
the woman gives the weather forecast,
the woman is touching a weather map,
she's predicting the weather,
she is giving a weather forecast,
she is showing a weather pattern,
giving a weather forecast on tv,
showing a weather map on tv,
she's showing the weather,
what they all do pretending to be right,
projecting her shitty mood on everyone else,
showing,
the weather,
the lady is explaining the weather map,
the woman is gesturing to a place on a weather map,
"the woman, is a weather forcaster",
pointing at a map,
giving the weather forecast,
