I23U,I23U Core
the girl is getting shot from the doctor,
the doctor is giving a shoot to a girl,
the doctor is giving the injection,
the girl is getting an injection from a doctor,
the doctor is injection to his patient,
a girl is about to get a shot by the doctor,
the girl is preparing to get vaccine,
the doctor is helping the girl to fix her ill,
the girl is ready for the injection and she feels nervous,
the doctor will give a vaccine to the girl,
the doctor is preparing for a injection of a girl,
the doctor is giving a flue shot to a little girl,
a girl is seeing a doctor,
the girl is trying to not cry,
the doctor is about to inject a girl in red dress,
a girl is getting vaccine from a doctor,
the doctor is helping the girl get better soon,
the girl is fearing the doctor's medic shoot,
the man is giving the girl a vaccine,
the man is treating the little girl,
the doctor is giving the girl a shot,
a doctor is giving s shot to a girl,
a girl is injected by a doctor,
this girl is required to injected by a doctor,
the doctor is preparing to inject medicine into the girl,
the doctor is paining for a girl,
the doctor is injecting something to a girl,
the doctor is giving a injection to the girl,
the doctor is vaccinating the girl,
a doctor is giving the injection for a girl,
the doctor is treating the girl,
the man is holding a girl's arm with a pin,
a doctor is giving a shot to a girl,
the doctor is giving a shoot to the girl,
the doctor is about is give shot to the girl,
a doctor is healing a girl,
the doctor is giving an injection to the girl,
the doctor is injecting a shoot to the little girl,
a doctor is trying to help a little girl with her ill,
"the girl is not happy with the doctor, who is going to give her a shoot",
the man is injecting the medicine,
the girl is getting a shot from a doctor,
a girl is taking injector by a doctor,
a girl is being nervous before she gets a shot,
the doctor is giving the therapy to a girl,
the girl is taking an antidote shot for a virus,
the girl is taking the medicine from the needle by the doctor,
the girl is getting immunization from the doctor,
the girl is getting the injection,
the doctor is taking a medicine for the girl,
the doctor is trying to help the girl,
the doctor is giving the girl a shoot,
the doctor is giving the girl a injection,
the doctor is going to insert the girl,
the girl is being injected,
a doctor is about to inject something into a girl's body,
a girl is looking the doctor,
a doctor is giving medical care to a girl,
the doctor try to heals the little girl,
the little girl is scared by the doctor,
a doctor is going to give a injection to a girl,
a male doctor is going to cure one girl,
the girl is little bit nervous about treatment from the doctor,
this little girl hate to get the shoot but she have to,
a doctor is going to cure the girl,
the doctor is going to vaccinate the girl,
a doctor is going to help a girl,
the doctor will give the girl a shot,
the little girl is suffering a terrible thing,
a doctor is giving a girl a shot,
a girl is receiving an injection from a doctor,
a doctor gives a girl a shot,
a girl prepares to receive a shot,
a girl is receiving a shot from a doctor,
the doctor is giving a patient a shot in the arm,
the girl is upset she's getting a shot from the doctor,
the doctor is giving a shot,
she is getting a shot,
a doctor is about to give a young girl an injection,
a young girl is plotting her escape from a doctor who is about to give her an injection,
the girl is getting a shot,
the doctor is about to give a girl a shot,
the doctor is going to administer a vaccine,
the girl is getting her immunizations,
the doctor is hoping to discover a cure for the zombie apocolypse using the girls blood,
the girl is about to get a shot,
the doctor is going to give the girl a shot,
the girl is upset about getting a shot,
she is being vaccinated,
the doctor is giving a little girl a shot,
a little girl is scared to get her shot,
the girl is afraid of getting a shot,
the girl is becoming angry because she believes she will become autistic after being vaccinated,
a girl is getting a shot,
a doctor is giving a shot to a little girl,
the little girl is about to get a shot,
the doctor is about to give a shot to the girl,
the doctor prepares to vaccinate the young girl,
the young girls is unhappy because the doctor is about to poke her with a needle,
the girl is getting a shot from the doctor,
the girl is getting a shot in her arm from the doctor,
the doctor is giving a shot to the girl,
the girls is afraid to get her shot,
a doctor is about to give a girl a shot,
a girl is seeing a doctor for a shot,
she doesn't like going to the doctors,
a doctor is about to give a little girl a shot,
a little girl is unhappy about getting a shot from her doctor,
the doctor is giving his patient a shot,
the little girl is not pleased with getting a shot at her doctor appointment,
girl is getting a shot,
doctor is giving the girl a shot,
girl is wondering if the shot will her pain,
the doctor is ready to inject the medicine in the arm of the girl,
a child is going to be vaccinated by a doctor,
a nervous young girl is waiting for the doctor to put a needle in her arm,
the doctor is giving the little girl a needle,
the little girl is sad that shes getting a needle,
the girl is getting a vaccine,
the doctor is giving the girl a vaccine,
a girl is getting a vaccine,
the doctor is about to give a shot,
a girl is about to get a shot,
a child is about to get a shot,
the little girl is about to get a shot from the doctor,
the little girl is sad about having to get a shot from the doctor,
the doctor wants to give the girl a shot,
the little girl is not happy and is afraid because she needs to get a shot from the doctor to keep her well,
a little girl is getting a shot from a doctor,
a doctor is giving a little girl a shot,
the doctor has told the wound lady that the shot he is to give her that it won't hurt,
the doctor is trying to assure the young lady that the shothe is giving her will protect her from a serious ailment,
the doctor is administering a vaccine,
the girl looks worried,
the girl is about tooget a shot,
the doctor is giving a shot to a girl who is not happy,
an unhappy girl is getting a shot from a doctor,
the doctor is about to give the little girl a flu shot,
the little girl is scared to receive one of her vaccines,
an unhappy young girl gets a shot from the doctor,
the doctor is administering a shot to a little girl,
susan is reconsidering the meth prescription,
frank giving shots without gloves to a standing patient,
the girl is not looking forward the shot she is about to get,
the doctor is about to give a shot to an unhappy girl,
the doctor is about to give an unhappy little girl a shot,
the little girl is about to cry because the doctor is going to give her a shot,
a girl is going to get a vaccination,
the girl is worried it will hurt,
a little girl is about to get a shot from her pediatrician,
the doctor is about to give a shot to a frightened young girl,
the doctor is giving the little girl a shot,
the little girl is getting a shot from the doctor,
the girl is going to get a shot,
the doctor is giving a vaccination,
a little girl is scared of a needle,
the dr is giving the girl a shot,
the doctor is giving a shot to a little girl and she is not happy about it,
the little girl is scared of the shot the doctor is about to give her,
the doctor is administering a shot,
"a child, who is about to receive an injection, looks nervous",
a doctor is about to give an injection to a nervous child,
the doctor is preparing to give a shot to the girl,
the doctor is preparing to give the girl a shot,
a child is about to get a needed vaccination,
a doctor is prepared to inoculate a child,
child contemplates revenge,
"if i don't look at the needle, it won't hurt as long",
i am getting a shot today,
"i might cry if i get a shot, but it's ok",
girl is being vaccinated,
a girl is receiving her vaccines,
little veronica is worried that the flu vaccine that dr. anderson is about to give her will hurt,
the doctor gives a girl a shot,
b,
j,
the girl is afraid to get a shot,
the doctor is prepared to immunize the nervous girl,
a girl is about to get a shot from her doctor,
a doctor is about to give a shot to a girl,
doctor going to give young child a needle,
young child is about to get a vaccination,
vaccination,
girl scared,
hahahaha,
hahaha,
little girl receiving an std vaccine from a victim of the disease,
old guy with a bad toupee giving measles injection to a young girl who is missing a math exam at school to be at her doc appt,
the girl is not very happy about receiving a shot today,
dr mengele is indulging in his favorite hobby,
