ResponseID,Response,Core,Answer,Gramm,Interp,Verif
I08T-gNSF-p142-r1,The waiter is serving a chicken to a woman.,1,1,1,1,1
I08T-gNSF-p142-r2,The waiter is bringing a customer a hot turkey.,1,1,1,1,1
I08T-gNSF-p145-r1,He is serving dinner. ,1,1,1,1,1
I08T-gNSF-p145-r2,The waiter is bringing out a meal.,1,1,1,1,1
I08T-gNSF-p146-r1,The waiter is serving food.,1,1,1,1,1
I08T-gNSF-p146-r2,The waiter is carrying food to the table.,1,1,1,1,1
I08T-gNSF-p147-r1,The waiter is serving the woman. ,1,1,1,1,1
I08T-gNSF-p147-r2,The waiter is serving the woman an entire turkey. ,1,1,1,1,1
I08T-gNSF-p148-r1,He is serving her diner.,1,1,1,1,1
I08T-gNSF-p148-r2,He is serving a chicken.,1,1,1,1,1
I08T-gNSF-p149-r1,The waiter is serving an entire roast turkey to a woman sitting alone at a table. ,1,1,1,1,1
I08T-gNSF-p149-r2,The waiter appears to be taking great pride in presenting an entire roast turkey to a woman sitting alone at a table. ,1,1,1,1,1
I08T-gNSF-p150-r2,The waiter is serving a turkey. ,1,1,1,1,1
I08T-gNSC-p152-r1,The waiter appears to be presenting a large cooked bird to a solitary diner,1,1,1,1,1
I08T-gNSC-p159-r1,The waiter is presenting a meal to a customer.,1,1,1,1,1
I08T-gNSC-p163-r1,Placing the turkey on the table,1,1,1,1,1
I08T-gNSC-p168-r1,The waiter is presenting an enormous amount of food for the single woman.,1,1,1,1,1
I08T-gNSC-p168-r2,The waiter is serving her order.,1,1,1,1,1
I08T-gNSC-p169-r1,the waiter is serving dinner,1,1,1,1,1
I08T-gNSC-p169-r2,the waiter is bringing a turkey,1,1,1,1,1
I08T-gNSC-p173-r1,He's serving an entire turkey to the lady.,1,1,1,1,1
I08T-gNSC-p174-r1,He is delivering and serving food to the customer.,1,1,1,1,1
I08T-gNSC-p174-r2,He is delivering and serving food to the customer. ,1,1,1,1,1
I08T-gNSC-p175-r1,The waiter is serving food to the lady.,1,1,1,1,1
I08T-gNSC-p175-r2,A platter of turkey is being served by the waiter.,1,0,1,1,1
I08T-gNSC-p176-r1,Delivering food,1,1,1,1,1
I08T-gNSC-p177-r1,The waiter is serving the woman food.,1,1,1,1,1
I08T-gNSC-p177-r2,He is serving the diner.,1,1,1,1,1
I08T-gNSC-p187-r1,He's serving a roast chicken.,1,1,1,1,1
I08T-gNSC-p187-r2,He's serving the lady.,1,1,1,1,1
I08T-gNSC-p190-r1,The waiter is serving dinner.,1,1,1,1,1
I08T-gNSC-p190-r2,The server is serving a chicken dinner.,1,0,1,1,1
I08T-gNSC-p192-r1,The waiter is delivering a fowl to the lady.,1,1,1,1,1
I08T-gNSC-p192-r2,The lady is receiving her order of a fowl.,1,0,1,1,1
I08T-gNSC-p199-r1,The waiter is delivering the woman food.,1,1,1,1,1
I08T-gNSC-p199-r2,The waiter is delivering the woman with a giant turkey.,1,1,0,1,1
I08T-gNSC-p202-r1,The waiter is serving his customer.,1,1,1,1,1
I08T-gNSC-p202-r2,He's bringing his customer her food.,1,1,1,1,1
I08T-gNSC-p211-r1,This waiter is serving a lone diner a huge amount of food. ,1,0,1,1,1
I08T-gNSC-p212-r1,He's serving dinner. ,1,1,1,1,1
I08T-gNSC-p212-r2,He's brought her dinner. ,1,0,1,1,1
I08T-gNSC-p213-r1,The waiter is serving a whole turkey to the woman.,1,1,1,1,1
I08T-gNSC-p215-r1,The waiter is serving a meal.,1,1,1,1,1
I08T-gNSC-p215-r2,He is serving a meal.,1,1,1,1,1
I08T-gNSC-p216-r1,serving a customer,1,1,1,1,1
I08T-gNSC-p216-r2,bringing out a meal,1,1,1,1,1
I08T-gNSC-p217-r1,The waiter is bringing the woman an entire turkey?,1,1,1,1,1
I08T-gNSC-p217-r2,The waiter is bringing his customer her meal.,1,1,1,1,1
I08T-gNSC-p220-r1,The waiter is serving the woman's turkey.,1,1,1,1,1
I08T-gNSC-p222-r1,Serving food,1,1,1,1,1
I08T-gNSC-p222-r2,Serving hot food,1,1,1,1,1
I08T-gNSC-p226-r1,This waiter is delivering a hot piece of meat,1,0,1,1,1
I08T-gNSC-p230-r1,The waiter is serving dinner.,1,1,1,1,1
I08T-gNSC-p230-r2,"The waiter making sure he delivers,the correct meal.",1,1,0,0,0
I08T-gNSC-p231-r1,Serving food to the lady. ,1,1,1,1,1
I08T-gNSC-p231-r2,Proudly serving food to the lady. ,1,1,1,1,1
I08T-gNSC-p234-r1,The waiter is serving dinner,1,1,1,1,1
I08T-gNSC-p235-r1,The man is serving the woman her food.,1,0,1,1,1
I08T-gNSC-p235-r2,The server is giving the customer her meal.,1,0,1,1,1
I08T-gNSC-p236-r1,The waiter is serving the woman food. ,1,1,1,1,1
I08T-gNSC-p236-r2,He is serving food to the woman. ,1,1,1,1,1
I08T-gNSC-p244-r1,The waiter is serving her a turkey. ,1,1,1,1,1
I08T-gNSC-p244-r2,The waiter is serving the customer food. ,1,1,1,1,1
I08T-gNSC-p245-r1,The waiter is serving a turkey to the woman.,1,1,1,1,1
I08T-gNSC-p245-r2,He is serving the customer her meal.,1,1,1,1,1
I08T-gNSC-p247-r2,The waiter is serving the woman a roasted turkey.,1,1,1,1,1
I08T-gNSC-p249-r1,The waiter is bringing the food.,1,1,1,1,1
I08T-gNSC-p249-r2,The waiter is serving the lady her food.,1,1,1,1,1
I08T-gNSC-p252-r1,serving the patron,1,1,1,1,1
I08T-gNSC-p253-r1,bringing the food to the table,1,1,1,1,1
I08T-gNSC-p254-r1,Bringing food to the table,1,1,1,1,1
I08T-gNSC-p254-r2,Bringing chicken to the table,1,1,1,1,1
I08T-gNSC-p255-r1,The waiter is serving a turkey dinner to a lady that will need a doggie bag to take most of it home.,1,1,1,1,0
I08T-gNSC-p260-r1,serving a patron,1,1,1,1,1
I08T-gNSC-p261-r1,The waiter is serving a turkey dinner.,1,1,1,1,1
I08T-gNSC-p261-r2,The waiter is delivering food to a table. ,1,1,1,1,1
I08T-gNSC-p262-r1,"Waiter presenting the main course before carving, for her approval",1,0,1,0,1
I08T-gNSC-p263-r1,The waiter is serving the woman her order.,1,1,1,1,1
I08T-gNSC-p264-r1,Serving dinner,1,1,1,1,1
I08T-gNSC-p264-r2,The waiter is serving a chicken,1,1,1,1,1
I08T-gNSC-p266-r1,A waiter is serving a roasted bird. ,1,0,1,1,1
I08T-gNSC-p266-r2,A woman is being served a roasted bird by a waiter. ,1,0,1,1,1
I08T-gNSC-p270-r1,He is serving dinner.,1,1,1,1,1
I08T-gNSC-p270-r2,He is serving chicken to a woman.,1,1,1,1,1
I08T-gNSC-p271-r1,The waiter is bringing the meal. ,1,1,1,1,1
I08T-gNSC-p271-r2,The waiter is delivering the meal. ,1,1,1,1,1
I08T-gNSC-p274-r1,The waiter is bringing food to the woman.,1,1,1,1,1
I08T-gNSC-p274-r2,The waiter is showing the food to the woman.,1,1,1,1,1
I08T-gNSC-p276-r1,The waiter is serving food to the lady.,1,1,1,1,1
I08T-gNSC-p276-r2,He is bringing her food.,1,1,1,1,1
I08T-gNSC-p277-r1,The waiter is serving a customer.,1,1,1,1,1
I08T-gNSC-p282-r1,The waiter is serving a chicken.,1,1,1,1,1
I08T-gNSC-p282-r2,The waiter is giving the lady a whole chicken.,1,1,1,1,1
I08T-gNSF-p293-r1,The waiter is serving the woman her food.,1,1,1,1,1
I08T-gNSF-p293-r2,He is bringing the woman her dinner.,1,1,1,1,1
I08T-gNSF-p299-r1,The waiter is serving dinner.,1,1,1,1,1
I08T-gNSF-p299-r2,The waiter is delivering chicken.,1,1,1,1,1
I08T-gNSF-p301-r1,The waiter is serving the customer.,1,1,1,1,1
I08T-gNSF-p301-r2,The waiter is delivering a chicken to the woman.,1,1,1,1,1
I08T-gNSF-p302-r1,He is serving the woman a meal.,1,1,1,1,1
I08T-gNSF-p302-r2,He is giving a turkey to the woman.,1,1,1,1,1
I08T-gNSF-p303-r1,The waiter is serving the woman turkey.,1,1,1,1,1
I08T-gNSF-p303-r2,The waiter is giving the customer her warm meal.,1,1,1,1,1
I08T-gNSF-p306-r1,The waiter is presenting the food.,1,1,1,1,1
I08T-gNSF-p306-r2,He is about to serve the dish.,1,1,1,1,1
I08T-gNSF-p495-r2,He is serving dinner.,1,1,1,1,1
I08T-gNSF-p496-r1,The waiter is serving the lady an entire turkey.,1,1,1,1,1
I08T-gNSF-p496-r2,"As the waiter serves the woman a whole chicken, he wonders if she will attempt to eat it all in one sitting. ",1,0,1,1,0
I08T-gNSF-p497-r1,He's serving the meal.,1,1,1,1,1
I08T-gNSF-p497-r2,He's serving dinner.,1,1,1,1,1
