ResponseID,Response,Core,Answer,Gramm,Interp,Verif
I10U-gNSC-p322-r1,The baby is crying.,1,1,1,1,1
I10U-gNSC-p322-r2,The baby is not happy about something.,0,1,1,1,1
I10U-gNSC-p325-r1,A baby is crying,1,1,1,1,1
I10U-gNSC-p325-r2,The baby in the diaper is upset,0,0,1,1,1
I10U-gNSC-p334-r1,A baby cries. ,1,0,1,1,1
I10U-gNSC-p334-r2,"A baby flies through the air, eyes closed and teary. ",0,0,1,1,0
I10U-gNSC-p343-r1,The little bady is crying for compassion,1,1,0,0,0
I10U-gNSC-p343-r2,The little baby crying for its mother,1,1,0,1,1
I10U-gNSC-p344-r1,baby is crying to be picked up,1,1,0,1,1
I10U-gNSC-p344-r2,baby is crying to have diaper changed,1,1,0,1,1
I10U-gNSC-p349-r1,A baby is crying.,1,1,1,1,1
I10U-gNSC-p349-r2,There is a crying baby.,1,1,1,1,1
I10U-gNSC-p352-r1,A baby is crying. ,1,1,1,1,1
I10U-gNSC-p352-r2,A child is naken. ,0,0,0,0,0
I10U-gNSC-p355-r1,The baby is crying.,1,1,1,1,1
I10U-gNSC-p355-r2,The baby is upset.,0,0,1,1,1
I10U-gNSC-p356-r1,A baby is crying. ,1,1,1,1,1
I10U-gNSC-p356-r2,Someone needs to tend to the baby. ,0,0,1,0,1
I10U-gNSC-p358-r1,A baby crying ,1,1,0,1,1
I10U-gNSC-p358-r2,A baby sitting down crying ,1,1,0,1,1
I10U-gNSC-p359-r1,A baby is crying.,1,1,1,1,1
I10U-gNSC-p359-r2,The crying baby wants to he held.,1,1,0,1,1
I10U-gNSC-p363-r1,The baby is crying to draw attention to it wet diaper. ,1,1,0,1,1
I10U-gNSC-p363-r2,The baby is frustrated because it wants to be picked up. ,0,0,1,1,1
I10U-gNSC-p364-r1,The baby is crying.,1,1,1,1,1
I10U-gNSC-p364-r2,The crying baby needs assistance.,1,0,1,1,1
I10U-gNSC-p365-r1,The baby is upset.,0,0,1,1,1
I10U-gNSC-p365-r2,This baby is crying.,1,1,1,1,1
I10U-gNSC-p367-r1,A crying baby.,0,0,0,1,0
I10U-gNSC-p367-r2,An upset infant.,0,0,0,1,0
I10U-gNSC-p370-r1,A baby is crying,1,1,1,1,1
I10U-gNSC-p370-r2,A baby is upset,0,0,1,1,1
I10U-gNSC-p374-r1,The baby is crying.,1,1,1,1,1
I10U-gNSC-p374-r2,The sad baby has red hair.,0,0,1,1,1
I10U-gNSC-p377-r1,crhying,0,0,0,0,0
I10U-gNSC-p377-r2,baby crying,1,1,0,1,1
I10U-gNSC-p379-r1,The baby is crying.,1,1,1,1,1
I10U-gNSC-p379-r2,The young baby is screaming.,1,1,1,1,1
I10U-gNSC-p380-r1,baby cries,1,0,0,1,1
I10U-gNSC-p380-r2,baby cries,1,0,0,1,1
I10U-gNSC-p383-r1,The baby is very unhappy.,0,0,1,1,1
I10U-gNSC-p383-r2,The baby cries incessantly.,1,0,1,1,1
I10U-gNSC-p385-r1,WHY IS THE BABY CRYING. ,1,0,1,1,0
I10U-gNSC-p385-r2,THE CRYING BABY NEEDS ATTENTION.,1,0,1,1,1
I10U-gNSC-p387-r1,The baby is upset and crying.,1,1,1,1,1
I10U-gNSC-p387-r2,The crying baby has a wet diaper.,1,0,1,1,1
I10U-gNSC-p390-r1,CHANGE MY DIAPER!,0,0,1,0,0
I10U-gNSC-p390-r2,FEED ME!,0,0,1,0,0
I10U-gNSC-p393-r1,The baby is crying.,1,1,1,1,1
I10U-gNSC-p393-r2,"The inconsolable baby is naked, but for a diaper.",0,0,1,1,1
I10U-gNSC-p394-r1,The baby is crying,1,1,1,1,1
I10U-gNSC-p394-r2,The baby is very sad,0,0,1,1,1
I10U-gNSC-p396-r1,The boy is crying so hard,0,1,1,1,1
I10U-gNSC-p396-r2,The crying of the boy is so loud,0,0,1,1,1
I10U-gNSC-p401-r1,The baby is crying loudly.,1,1,1,1,1
I10U-gNSC-p401-r2,A wet diaper causes the baby to cry loudly.,1,0,1,1,0
I10U-gNSC-p405-r1,A baby is crying. ,1,1,1,1,1
I10U-gNSC-p405-r2,The baby is sad. ,0,0,1,1,1
I10U-gNSC-p407-r1,The baby is crying ,1,1,1,1,1
I10U-gNSC-p407-r2,The baby is reaching for his mother,0,1,1,1,1
I10U-gNSC-p409-r1,A baby is crying.,1,1,1,1,1
I10U-gNSC-p409-r2,An infant wails.,1,0,1,1,1
I10U-gNSC-p410-r1,The baby is very unhappy and crying.,1,1,1,1,1
I10U-gNSC-p410-r2,The baby is crying and wants to be picked up.,1,1,1,1,1
I10U-gNSC-p411-r1,A baby in a diaper is crying.,1,1,1,1,1
I10U-gNSC-p411-r2,"The baby, who has a diaper on, is crying",1,1,1,1,1
I10U-gNSC-p413-r1,The baby cries.,1,0,1,1,1
I10U-gNSC-p413-r2,A baby is unhappy.,0,0,1,1,1
I10U-gNSC-p416-r1,Baby crying,1,1,0,1,1
I10U-gNSC-p416-r2,Crying baby,0,0,1,1,0
I10U-gNSC-p417-r1,The baby is crying,1,1,1,1,1
I10U-gNSC-p417-r2,The baby is upset,0,0,1,1,1
I10U-gNSC-p418-r1,A baby is crying.,1,1,1,1,1
I10U-gNSC-p418-r2,A baby is distraught and crying.,1,1,1,1,1
I10U-gNSC-p420-r1,"A baby, wearing only a diaper, is crying.",1,1,1,1,1
I10U-gNSC-p420-r2,A nearly bald baby with outstretched arms is crying.,1,1,1,1,1
I10U-gNSC-p423-r1,A baby is crying. ,1,1,1,1,1
I10U-gNSC-p423-r2,A child is upset.,0,0,1,1,1
I10U-gNSC-p424-r1,There is a baby crying,1,1,1,1,1
I10U-gNSC-p424-r2,Baby looking for something and cries out ,1,1,1,1,1
I10U-gNSC-p429-r1,A baby cries.,1,0,1,1,1
I10U-gNSC-p429-r2,A baby cries.,1,0,1,1,1
I10U-gNSC-p431-r1,A baby crying,1,1,0,1,1
I10U-gNSC-p431-r2,Hey sad baby crying ,1,1,0,1,1
I10U-gNSC-p433-r1,The baby is crying.,1,1,1,1,1
I10U-gNSC-p433-r2,The baby is sad. ,0,0,1,1,1
I10U-gNSC-p435-r1,little baby,0,0,0,0,0
I10U-gNSC-p435-r2,crying,0,0,1,0,0
I10U-gNSC-p436-r1,A baby is crying.,1,1,1,1,1
I10U-gNSC-p436-r2,A baby is upset about something.,0,0,1,1,1
I10U-gNSC-p438-r1,The baby is crying.,1,1,1,1,1
I10U-gNSC-p438-r2,The baby is upset.,0,0,1,1,1
I10U-gNSC-p447-r1,A baby is crying.,1,1,1,1,1
I10U-gNSC-p447-r2,A crying baby seeks attention.,1,0,1,1,1
I10U-gNSC-p448-r1,The baby is crying.,1,1,1,1,1
I10U-gNSC-p448-r2,The baby cries.,1,0,1,1,1
I10U-gNSC-p450-r1,baby is crying,1,1,0,1,1
I10U-gNSC-p450-r2,where is my mother ?,0,0,1,0,0
I10U-gNSC-p451-r1,The 3 baby is crying.,1,1,0,0,0
I10U-gNSC-p451-r2,The baby needs a diaper change.,0,0,1,1,0
I10U-gNSC-p452-r1,The baby has a dirty diaper.,0,0,1,1,0
I10U-gNSC-p452-r2,"The little baby is fussy, and needs his diaper changed. ",0,0,1,1,0
I10U-gNSC-p453-r1,The baby is crying.,1,1,1,1,1
I10U-gNSC-p453-r2,The baby is crying for his mom.,1,1,1,1,1
I10U-gNSC-p455-r1,The baby is crying.,1,1,1,1,1
I10U-gNSC-p455-r2,The baby is upset.,0,0,1,1,1
I10U-gNSC-p456-r1,The baby is crying.,1,1,1,1,1
I10U-gNSC-p456-r2,Tears are coming out of the baby's eyes.,1,1,1,1,1
I10U-gNSC-p457-r1,A baby is crying. ,1,1,1,1,1
I10U-gNSC-p457-r2,"The baby is not happy,", , , , , 
I10U-gNSC-p460-r1,The baby crying is wearing a diaper.,1,1,1,1,1
I10U-gNSC-p460-r2,The baby wearing a diaper is crying.,1,1,1,1,1
I10U-gNSC-p461-r1,The baby is crying tear of sadness.,1,1,0,1,1
I10U-gNSC-p461-r2,Tear of sadness appear because the baby is upset.,0,0,0,1,1
I10U-gNSC-p462-r1,A baby is crying.,1,1,1,1,1
I10U-gNSC-p462-r2,Tears are being shed by a baby.,1,1,1,1,1
I10U-gNSC-p467-r1,"Wet and hungry, the baby is voicing his needs in the only way he knows how.",0,1,1,0,1
I10U-gNSC-p467-r2,Scolding a baby will often result in crying as a reaction,0,0,1,0,0
I10U-gNSC-p469-r1,The baby is crying.,1,1,1,1,1
I10U-gNSC-p469-r2,An abandoned infant is emotionally scarred for life.,0,0,1,0,0
I10U-gNSC-p472-r1,This baby is displeased about something.,0,0,1,1,1
I10U-gNSC-p472-r2,"This baby is the center of his world and expects his mother, or someone to orbit nearby to care for his every need, or desire, as he should.",0,0,1,0,0
I10U-gNSC-p479-r1,A baby is crying.,1,1,1,1,1
I10U-gNSC-p479-r2,A baby is pitching a fit.,1,1,1,1,1
I10U-gNSC-p482-r1,The baby is crying. ,1,1,1,1,1
I10U-gNSC-p482-r2,The baby is not happy. ,0,0,1,1,1
I10U-gNSC-p483-r1,The baby cries.,1,0,1,1,1
I10U-gNSC-p483-r2,The baby needs his diaper to be changed.,0,0,1,1,1
I10U-gNSC-p485-r1,The baby cries tears.,1,0,1,1,1
I10U-gNSC-p485-r2,Tears are cried by the baby.,1,0,1,1,1
I10U-gNSC-p486-r1,The small baby is crying profusely. ,1,1,1,1,1
I10U-gNSC-p486-r2,The young baby wants to be picked up and cuddled.,0,0,1,0,1
I10U-gNSC-p487-r1,a babys crying ,1,1,0,1,1
I10U-gNSC-p487-r2,a baby is sitting,0,1,1,1,1
I10U-gNSC-p491-r1,The baby is crying.,1,1,1,1,1
I10U-gNSC-p491-r2,The baby may have a dirty diaper.,0,0,1,0,0
I10U-gNSC-p493-r1,A baby is crying,1,1,1,1,1
I10U-gNSC-p493-r2,A baby displays it's displeasure,0,0,0,1,1
